id,draw_id,draw_code,draw_date,draw_date_format,ball_1,ball_2,ball_3,ball_4,ball_5,ball_6,golden_ball,balls,jackpot_prize,number_of_jackpot,jackpot_1_prize,number_of_jackpot_1
1,460,#00460,06/08/2020,2020-08-06 00:00:00.000000,02,05,21,24,26,27,11,02 05 21 24 26 27,35484039300,0,3609337700,0
2,459,#00459,04/08/2020,2020-08-04 00:00:00.000000,10,15,20,21,32,51,08,10 15 20 21 32 51,34160517300,0,3462279700,0
3,458,#00458,01/08/2020,2020-08-01 00:00:00.000000,13,18,29,30,40,47,04,13 18 29 30 40 47,32664333450,0,3296037050,0
4,457,#00457,30/07/2020,2020-07-30 00:00:00.000000,06,07,16,26,29,54,04,06 07 16 26 29 54,31179786600,0,3131087400,0
5,456,#00456,28/07/2020,2020-07-28 00:00:00.000000,03,11,20,34,44,54,16,03 11 20 34 44 54,108125269950,1,6969310000,1
6,455,#00455,25/07/2020,2020-07-25 00:00:00.000000,02,19,21,34,54,55,24,02 19 21 34 54 55,102347224500,0,6327304950,0
7,454,#00454,23/07/2020,2020-07-23 00:00:00.000000,04,12,31,47,49,52,02,04 12 31 47 49 52,97175363250,0,5752653700,0
8,453,#00453,21/07/2020,2020-07-21 00:00:00.000000,06,14,31,37,38,44,04,06 14 31 37 38 44,91825726800,0,5158249650,0
9,452,#00452,18/07/2020,2020-07-18 00:00:00.000000,03,13,22,28,30,53,16,03 13 22 28 30 53,86441982150,0,4560055800,0
10,451,#00451,16/07/2020,2020-07-16 00:00:00.000000,02,05,11,20,24,32,06,02 05 11 20 24 32,82008822450,0,4067482500,0
11,450,#00450,14/07/2020,2020-07-14 00:00:00.000000,05,22,32,34,43,51,12,05 22 32 34 43 51,77917521900,0,3612893550,0
12,449,#00449,11/07/2020,2020-07-11 00:00:00.000000,03,04,06,14,20,38,35,03 04 06 14 20 38,74543157300,0,3237964150,0
13,448,#00448,09/07/2020,2020-07-09 00:00:00.000000,03,10,11,17,26,54,21,03 10 11 17 26 54,72401479950,0,3472460950,1
14,447,#00447,07/07/2020,2020-07-07 00:00:00.000000,07,24,32,35,48,50,01,07 24 32 35 48 50,70362637500,0,3245922900,0
15,446,#00446,04/07/2020,2020-07-04 00:00:00.000000,03,09,10,18,29,45,36,03 09 10 18 29 45,68149331400,0,3853016050,1
16,445,#00445,02/07/2020,2020-07-02 00:00:00.000000,04,10,20,38,48,53,05,04 10 20 38 48 53,66366603300,0,3654935150,0
17,444,#00444,30/06/2020,2020-06-30 00:00:00.000000,05,11,18,19,20,21,52,05 11 18 19 20 21,64312813650,0,3426736300,0
18,443,#00443,27/06/2020,2020-06-27 00:00:00.000000,02,06,38,47,50,53,14,02 06 38 47 50 53,62496583500,0,3224932950,0
19,442,#00442,25/06/2020,2020-06-25 00:00:00.000000,09,10,12,19,27,40,55,09 10 12 19 27 40,60472186950,0,3613345900,1
20,441,#00441,23/06/2020,2020-06-23 00:00:00.000000,02,18,28,46,52,54,19,02 18 28 46 52 54,58805962050,0,3428209800,0
21,440,#00440,20/06/2020,2020-06-20 00:00:00.000000,05,09,33,43,44,50,46,05 09 33 43 44 50,56914961250,0,3218098600,0
22,439,#00439,18/06/2020,2020-06-18 00:00:00.000000,05,18,27,45,50,54,09,05 18 27 45 50 54,54952073850,0,3122220850,1
23,438,#00438,16/06/2020,2020-06-16 00:00:00.000000,02,15,16,23,33,54,45,02 15 16 23 33 54,53852086200,0,3735115200,1
24,437,#00437,13/06/2020,2020-06-13 00:00:00.000000,07,09,11,30,43,53,10,07 09 11 30 43 53,52151425050,0,3546152850,0
25,436,#00436,11/06/2020,2020-06-11 00:00:00.000000,03,21,25,32,35,52,34,03 21 25 32 35 52,50713813200,0,3386418200,0
26,435,#00435,09/06/2020,2020-06-09 00:00:00.000000,01,03,08,22,42,48,44,01 03 08 22 42 48,49186580250,0,3216725650,0
27,434,#00434,06/06/2020,2020-06-06 00:00:00.000000,08,12,24,32,35,51,21,08 12 24 32 35 51,47236049400,0,7251116250,1
28,433,#00433,04/06/2020,2020-06-04 00:00:00.000000,06,12,16,34,39,54,19,06 12 16 34 39 54,45728364900,0,7083595750,0
29,432,#00432,02/06/2020,2020-06-02 00:00:00.000000,04,19,31,42,48,55,22,04 19 31 42 48 55,44372894250,0,6932987900,0
30,431,#00431,30/05/2020,2020-05-30 00:00:00.000000,12,13,41,42,48,53,20,12 13 41 42 48 53,42364771950,0,6709863200,0
31,430,#00430,28/05/2020,2020-05-28 00:00:00.000000,01,04,08,21,44,49,52,01 04 08 21 44 49,40722802950,0,6527422200,0
32,429,#00429,26/05/2020,2020-05-26 00:00:00.000000,11,12,23,24,34,47,43,11 12 23 24 34 47,39110032200,0,6348225450,0
33,428,#00428,23/05/2020,2020-05-23 00:00:00.000000,04,13,27,47,50,55,31,04 13 27 47 50 55,37457550750,0,6164616400,0
34,427,#00427,21/05/2020,2020-05-21 00:00:00.000000,02,15,22,25,30,46,10,02 15 22 25 30 46,35786056800,0,5978894850,0
35,426,#00426,19/05/2020,2020-05-19 00:00:00.000000,05,15,16,19,49,55,03,05 15 16 19 49 55,34151397600,0,5797266050,0
36,425,#00425,16/05/2020,2020-05-16 00:00:00.000000,19,35,38,49,52,55,01,19 35 38 49 52 55,32685784500,0,5634420150,0
37,424,#00424,14/05/2020,2020-05-14 00:00:00.000000,07,23,29,47,51,55,12,07 23 29 47 51 55,31171245600,0,5466138050,0
38,423,#00423,12/05/2020,2020-05-12 00:00:00.000000,01,08,25,34,38,44,28,01 08 25 34 38 44,192141839100,1,5335999650,0
39,422,#00422,09/05/2020,2020-05-09 00:00:00.000000,18,19,30,39,45,46,11,18 19 30 39 45 46,183593994150,0,4386239100,0
40,421,#00421,07/05/2020,2020-05-07 00:00:00.000000,09,19,28,30,32,54,22,09 19 28 30 32 54,175919619900,0,3533530850,0
41,420,#00420,05/05/2020,2020-05-05 00:00:00.000000,01,04,13,15,18,20,22,01 04 13 15 18 20,171117842250,0,4915251500,1
42,419,#00419,02/05/2020,2020-05-02 00:00:00.000000,02,06,09,16,43,53,19,02 06 09 16 43 53,163627248450,0,4082963300,0
43,418,#00418,30/04/2020,2020-04-30 00:00:00.000000,12,31,32,33,39,41,14,12 31 32 33 39 41,157535203350,0,3406069400,0
44,417,#00417,28/04/2020,2020-04-28 00:00:00.000000,04,06,10,16,30,46,34,04 06 10 16 30 46,153880578750,0,4167848001,3
45,416,#00416,25/04/2020,2020-04-25 00:00:00.000000,04,18,24,30,53,55,13,04 18 24 30 53 55,147103949100,0,3414889150,0
46,415,#00415,31/03/2020,2020-03-31 00:00:00.000000,12,19,40,41,43,53,23,12 19 40 41 43 53,143369946750,0,3643539800,2
47,414,#00414,28/03/2020,2020-03-28 00:00:00.000000,01,10,11,13,27,55,19,01 10 11 13 27 55,137578088550,0,8574074450,1
48,413,#00413,26/03/2020,2020-03-26 00:00:00.000000,07,08,11,31,35,36,45,07 08 11 31 35 36,130391512500,0,7775566000,0
49,412,#00412,24/03/2020,2020-03-24 00:00:00.000000,03,09,20,21,33,52,50,03 09 20 21 33 52,123683187000,0,7030196500,0
50,411,#00411,21/03/2020,2020-03-21 00:00:00.000000,10,12,14,17,29,53,25,10 12 14 17 29 53,116918632650,0,6278579350,0
51,410,#00410,19/03/2020,2020-03-19 00:00:00.000000,03,35,41,42,43,49,31,03 35 41 42 43 49,110372538000,0,5551235500,0
52,409,#00409,17/03/2020,2020-03-17 00:00:00.000000,01,14,18,43,49,50,08,01 14 18 43 49 50,104401521300,0,4887789200,0
53,408,#00408,14/03/2020,2020-03-14 00:00:00.000000,12,20,25,38,39,40,37,12 20 25 38 39 40,98660027100,0,4249845400,0
54,407,#00407,12/03/2020,2020-03-12 00:00:00.000000,02,14,19,24,27,34,48,02 14 19 24 27 34,93827290800,0,3712874700,0
55,406,#00406,10/03/2020,2020-03-10 00:00:00.000000,23,25,30,36,45,52,53,23 25 30 36 45 52,89968227600,0,3284089900,0
56,405,#00405,07/03/2020,2020-03-07 00:00:00.000000,05,11,21,30,40,48,20,05 11 21 30 40 48,87411418500,0,3761291650,1
57,404,#00404,05/03/2020,2020-03-05 00:00:00.000000,08,09,34,40,41,54,13,08 09 34 40 41 54,83145846450,0,3287339200,0
58,403,#00403,03/03/2020,2020-03-03 00:00:00.000000,14,15,31,40,43,49,12,14 15 31 40 43 49,80559793650,0,5964207600,1
59,402,#00402,29/02/2020,2020-02-29 00:00:00.000000,09,17,23,26,51,54,32,09 17 23 26 51 54,75711825300,0,5425544450,0
60,401,#00401,27/02/2020,2020-02-27 00:00:00.000000,03,11,21,29,47,55,50,03 11 21 29 47 55,73148581650,0,5140739600,0
61,400,#00400,25/02/2020,2020-02-25 00:00:00.000000,05,13,21,36,39,48,06,05 13 21 36 39 48,71004697950,0,4902530300,0
62,399,#00399,22/02/2020,2020-02-22 00:00:00.000000,07,24,32,49,51,54,44,07 24 32 49 51 54,68557422900,0,4630610850,0
63,398,#00398,20/02/2020,2020-02-20 00:00:00.000000,01,03,20,33,36,51,49,01 03 20 33 36 51,66299572650,0,4379738600,0
64,397,#00397,18/02/2020,2020-02-18 00:00:00.000000,27,32,36,37,47,48,50,27 32 36 37 47 48,64111378350,0,4136605900,0
65,396,#00396,15/02/2020,2020-02-15 00:00:00.000000,26,36,37,38,42,49,46,26 36 37 38 42 49,61707788850,0,3869540400,0
66,395,#00395,13/02/2020,2020-02-13 00:00:00.000000,25,28,32,34,35,39,07,25 28 32 34 35 39,59497631400,0,3623967350,0
67,394,#00394,11/02/2020,2020-02-11 00:00:00.000000,04,14,18,21,32,53,02,04 14 18 21 32 53,57387718200,0,3389532550,0
68,393,#00393,08/02/2020,2020-02-08 00:00:00.000000,09,12,19,25,41,54,38,09 12 19 25 41 54,55406377200,0,3169383550,0
69,392,#00392,06/02/2020,2020-02-06 00:00:00.000000,13,18,34,36,45,49,37,13 18 34 36 45 49,53881925250,0,3660378200,1
70,391,#00391,04/02/2020,2020-02-04 00:00:00.000000,06,10,20,47,52,55,46,06 10 20 47 52 55,52092567750,0,3461560700,0
71,390,#00390,01/02/2020,2020-02-01 00:00:00.000000,02,03,11,23,35,54,06,02 03 11 23 35 54,49743734700,0,3200579250,0
72,389,#00389,30/01/2020,2020-01-30 00:00:00.000000,12,18,28,30,47,50,41,12 18 28 30 47 50,47938521450,0,3610751850,1
73,388,#00388,28/01/2020,2020-01-28 00:00:00.000000,01,20,24,33,40,55,46,01 20 24 33 40 55,45952786650,0,3390114650,0
74,387,#00387,23/01/2020,2020-01-23 00:00:00.000000,09,15,18,25,31,49,46,09 15 18 25 31 49,44100944850,0,3184354450,0
75,386,#00386,21/01/2020,2020-01-21 00:00:00.000000,14,31,45,47,52,54,13,14 31 45 47 52 54,42441754800,0,6030452650,1
76,385,#00385,18/01/2020,2020-01-18 00:00:00.000000,13,18,19,23,32,43,11,13 18 19 23 32 43,40085895450,0,5768690500,0
77,384,#00384,16/01/2020,2020-01-16 00:00:00.000000,10,11,26,33,44,46,55,10 11 26 33 44 46,38298729900,0,5570116550,0
78,383,#00383,14/01/2020,2020-01-14 00:00:00.000000,03,04,17,39,50,51,53,03 04 17 39 50 51,36634873800,0,5385243650,0
79,382,#00382,11/01/2020,2020-01-11 00:00:00.000000,08,11,17,19,25,47,53,08 11 17 19 25 47,34734762300,0,5174120150,0
80,381,#00381,09/01/2020,2020-01-09 00:00:00.000000,17,20,21,29,52,54,51,17 20 21 29 52 54,33409526250,0,5026871700,0
81,380,#00380,07/01/2020,2020-01-07 00:00:00.000000,08,11,16,22,42,54,13,08 11 16 22 42 54,31673873550,0,4834021400,0
82,379,#00379,04/01/2020,2020-01-04 00:00:00.000000,04,14,26,42,44,55,48,04 14 26 42 44 55,111099202950,1,4648035450,0
83,378,#00378,02/01/2020,2020-01-02 00:00:00.000000,12,14,26,29,33,40,50,12 14 26 29 33 40,108639141150,0,4374695250,0
84,377,#00377,31/12/2019,2019-12-31 00:00:00.000000,02,22,26,28,44,55,27,02 22 26 28 44 55,105104974350,0,3982010050,0
85,376,#00376,28/12/2019,2019-12-28 00:00:00.000000,10,17,26,28,29,32,21,10 17 26 28 29 32,101245855800,0,3553219100,0
86,375,#00375,26/12/2019,2019-12-26 00:00:00.000000,05,06,12,18,23,54,26,05 06 12 18 23 54,98509997550,0,3249234850,0
87,374,#00374,24/12/2019,2019-12-24 00:00:00.000000,03,16,30,34,50,55,48,03 16 30 34 50 55,96266883900,0,4100571850,2
88,373,#00373,21/12/2019,2019-12-21 00:00:00.000000,05,08,20,34,37,42,51,05 08 20 34 37 42,93381149550,0,3779934700,0
89,372,#00372,19/12/2019,2019-12-19 00:00:00.000000,18,22,25,28,29,34,50,18 22 25 28 29 34,91007696550,0,3516217700,0
90,371,#00371,17/12/2019,2019-12-17 00:00:00.000000,04,05,14,19,22,37,43,04 05 14 19 22 37,88681195200,0,3257717550,0
91,370,#00370,14/12/2019,2019-12-14 00:00:00.000000,03,30,33,34,40,47,26,03 30 33 34 40 47,86361737250,0,4724065750,1
92,369,#00369,12/12/2019,2019-12-12 00:00:00.000000,01,09,15,42,49,50,48,01 09 15 42 49 50,83862112800,0,4446329700,0
93,368,#00368,10/12/2019,2019-12-10 00:00:00.000000,05,20,33,42,43,49,26,05 20 33 42 43 49,81294373650,0,4161025350,0
94,367,#00367,07/12/2019,2019-12-07 00:00:00.000000,07,18,38,42,47,51,08,07 18 38 42 47 51,78697118100,0,3872441400,0
95,366,#00366,05/12/2019,2019-12-05 00:00:00.000000,09,11,16,27,35,40,51,09 11 16 27 35 40,76939767750,0,3677180250,0
96,365,#00365,03/12/2019,2019-12-03 00:00:00.000000,21,29,36,41,50,52,42,21 29 36 41 50 52,75051358950,0,3467357050,0
97,364,#00364,30/11/2019,2019-11-30 00:00:00.000000,08,09,10,32,44,50,15,08 09 10 32 44 50,72655918050,0,3201196950,0
98,363,#00363,28/11/2019,2019-11-28 00:00:00.000000,01,18,26,28,53,55,14,01 18 26 28 53 55,70845145500,0,3209152250,1
99,362,#00362,26/11/2019,2019-11-26 00:00:00.000000,07,19,38,41,42,47,04,07 19 38 41 42 47,68962775250,0,14805039150,3
100,361,#00361,23/11/2019,2019-11-23 00:00:00.000000,07,29,30,45,50,55,15,07 29 30 45 50 55,66837919800,0,4698918000,0
101,360,#00360,21/11/2019,2019-11-21 00:00:00.000000,21,24,35,38,42,47,34,21 24 35 38 42 47,64726581900,0,4464324900,0
102,359,#00359,19/11/2019,2019-11-19 00:00:00.000000,19,21,33,35,38,40,04,19 21 33 35 38 40,62562161550,0,4223833750,0
103,358,#00358,16/11/2019,2019-11-16 00:00:00.000000,06,08,18,22,49,52,10,06 08 18 22 49 52,60416984100,0,3985480700,0
104,357,#00357,14/11/2019,2019-11-14 00:00:00.000000,09,12,16,36,41,55,35,09 12 16 36 41 55,58593943200,0,3782920600,0
105,356,#00356,12/11/2019,2019-11-12 00:00:00.000000,10,17,24,27,36,39,33,10 17 24 27 36 39,56779236300,0,3581286500,0
106,355,#00355,09/11/2019,2019-11-09 00:00:00.000000,01,03,06,25,29,41,12,01 03 06 25 29 41,55018617150,0,3385662150,0
107,354,#00354,07/11/2019,2019-11-07 00:00:00.000000,01,12,19,37,44,52,18,01 12 19 37 44 52,53142153150,0,3177166150,0
108,353,#00353,05/11/2019,2019-11-05 00:00:00.000000,03,06,16,17,44,50,28,03 06 16 17 44 50,51547657800,0,5241750900,1
109,352,#00352,02/11/2019,2019-11-02 00:00:00.000000,02,15,34,35,48,50,32,02 15 34 35 48 50,49723313700,0,5039046000,0
110,351,#00351,31/10/2019,2019-10-31 00:00:00.000000,18,19,22,37,47,48,46,18 19 22 37 47 48,48060708600,0,4854312100,0
111,350,#00350,29/10/2019,2019-10-29 00:00:00.000000,12,15,16,31,43,55,11,12 15 16 31 43 55,46241529150,0,4652181050,0
112,349,#00349,26/10/2019,2019-10-26 00:00:00.000000,18,20,22,50,51,53,35,18 20 22 50 51 53,44324971050,0,4439230150,0
113,348,#00348,24/10/2019,2019-10-24 00:00:00.000000,09,14,23,41,45,50,13,09 14 23 41 45 50,42764346750,0,4265827450,0
114,347,#00347,22/10/2019,2019-10-22 00:00:00.000000,02,16,26,27,36,40,31,02 16 26 27 36 40,41541604500,0,4129967200,0
115,346,#00346,19/10/2019,2019-10-19 00:00:00.000000,01,10,21,26,42,43,25,01 10 21 26 42 43,39917681400,0,3949531300,0
116,345,#00345,17/10/2019,2019-10-17 00:00:00.000000,05,11,14,34,51,53,16,05 11 14 34 51 53,38474598450,0,3789188750,0
117,344,#00344,15/10/2019,2019-10-15 00:00:00.000000,09,12,29,46,48,53,03,09 12 29 46 48 53,36880715100,0,3612090600,0
118,343,#00343,12/10/2019,2019-10-12 00:00:00.000000,21,39,48,51,53,55,05,21 39 48 51 53 55,35556777750,0,3464986450,0
119,342,#00342,10/10/2019,2019-10-10 00:00:00.000000,04,17,42,51,53,55,29,04 17 42 51 53 55,34070500650,0,3299844550,0
120,341,#00341,08/10/2019,2019-10-08 00:00:00.000000,08,36,39,43,48,50,40,08 36 39 43 48 50,32751516900,0,3153290800,0
121,340,#00340,05/10/2019,2019-10-05 00:00:00.000000,10,29,30,31,37,51,50,10 29 30 31 37 51,31371899700,0,3359683250,1
122,339,#00339,03/10/2019,2019-10-03 00:00:00.000000,04,07,08,26,37,44,29,04 07 08 26 37 44,80834053800,1,3207249950,0
123,338,#00338,01/10/2019,2019-10-01 00:00:00.000000,05,22,38,41,47,49,29,05 22 38 41 47 49,78968804250,0,4610358600,1
124,337,#00337,28/09/2019,2019-09-28 00:00:00.000000,04,08,21,23,40,43,44,04 08 21 23 40 43,76640721150,0,4351682700,0
125,336,#00336,26/09/2019,2019-09-26 00:00:00.000000,07,12,38,43,51,55,15,07 12 38 43 51 55,74541701100,0,4118458250,0
126,335,#00335,24/09/2019,2019-09-24 00:00:00.000000,12,33,39,40,48,53,35,12 33 39 40 48 53,72724240650,0,3916518200,0
127,334,#00334,21/09/2019,2019-09-21 00:00:00.000000,02,05,23,30,42,45,34,02 05 23 30 42 45,70806645750,0,3703452100,0
128,333,#00333,19/09/2019,2019-09-19 00:00:00.000000,02,08,22,34,39,41,13,02 08 22 34 39 41,69277580400,0,3533555950,0
129,332,#00332,17/09/2019,2019-09-17 00:00:00.000000,03,14,26,38,43,47,10,03 14 26 38 43 47,67885940550,0,3378929300,0
130,331,#00331,14/09/2019,2019-09-14 00:00:00.000000,10,36,42,44,45,54,14,10 36 42 44 45 54,66202794750,0,3191913100,0
131,330,#00330,12/09/2019,2019-09-12 00:00:00.000000,18,29,32,33,45,49,40,18 29 32 33 45 49,64475576850,0,3179297550,1
132,329,#00329,10/09/2019,2019-09-10 00:00:00.000000,06,09,19,39,50,54,37,06 09 19 39 50 54,62861898900,0,4443960950,1
133,328,#00328,07/09/2019,2019-09-07 00:00:00.000000,07,17,31,35,38,46,16,07 17 31 35 38 46,61549528800,0,4298142050,0
134,327,#00327,05/09/2019,2019-09-05 00:00:00.000000,20,24,27,30,33,45,21,20 24 27 30 33 45,60028396500,0,4129127350,0
135,326,#00326,03/09/2019,2019-09-03 00:00:00.000000,13,14,29,35,41,55,25,13 14 29 35 41 55,58394904150,0,3947628200,0
136,325,#00325,31/08/2019,2019-08-31 00:00:00.000000,13,20,23,32,51,52,42,13 20 23 32 51 52,56692930350,0,3758520000,0
137,324,#00324,29/08/2019,2019-08-29 00:00:00.000000,10,11,12,23,27,48,09,10 11 12 23 27 48,54916559850,0,3561145500,0
138,323,#00323,27/08/2019,2019-08-27 00:00:00.000000,16,22,29,33,46,47,55,16 22 29 33 46 47,53375693250,0,3389938100,0
139,322,#00322,24/08/2019,2019-08-24 00:00:00.000000,19,20,34,40,49,51,01,19 20 34 40 49 51,51577194000,0,3190104850,0
140,321,#00321,22/08/2019,2019-08-22 00:00:00.000000,04,07,16,17,30,39,27,04 07 16 17 30 39,49866250350,0,4174804800,1
141,320,#00320,20/08/2019,2019-08-20 00:00:00.000000,10,30,38,48,54,55,46,10 30 38 48 54 55,48546543000,0,4028170650,0
142,319,#00319,17/08/2019,2019-08-17 00:00:00.000000,09,11,24,26,38,53,41,09 11 24 26 38 53,46901064450,0,3845339700,0
143,318,#00318,15/08/2019,2019-08-15 00:00:00.000000,19,25,31,32,39,47,08,19 25 31 32 39 47,45290687700,0,3666408950,0
144,317,#00317,13/08/2019,2019-08-13 00:00:00.000000,04,08,16,27,32,40,23,04 08 16 27 32 40,43839772950,0,3505196200,0
145,316,#00316,10/08/2019,2019-08-10 00:00:00.000000,07,17,36,42,43,50,44,07 17 36 42 43 50,42504716100,0,3356856550,0
146,315,#00315,08/08/2019,2019-08-08 00:00:00.000000,01,06,17,18,21,41,22,01 06 17 18 21 41,40878482250,0,3176163900,0
147,314,#00314,06/08/2019,2019-08-06 00:00:00.000000,09,11,19,20,26,42,17,09 11 19 20 26 42,39293007150,0,4032556350,1
148,313,#00313,03/08/2019,2019-08-03 00:00:00.000000,13,24,25,26,27,30,04,13 24 25 26 27 30,38078447700,0,3897605300,0
149,312,#00312,01/08/2019,2019-08-01 00:00:00.000000,01,18,39,45,48,49,26,01 18 39 45 48 49,36751522800,0,3750169200,0
150,311,#00311,30/07/2019,2019-07-30 00:00:00.000000,03,08,12,21,32,51,07,03 08 12 21 32 51,35273732250,0,3585970250,0
151,310,#00310,27/07/2019,2019-07-27 00:00:00.000000,02,03,25,33,44,50,17,02 03 25 33 44 50,33976192350,0,3441799150,0
152,309,#00309,25/07/2019,2019-07-25 00:00:00.000000,03,31,34,41,52,53,16,03 31 34 41 52 53,32670348600,0,3296705400,0
153,308,#00308,23/07/2019,2019-07-23 00:00:00.000000,05,10,21,32,39,52,41,05 10 21 32 39 52,31304538750,0,3144948750,0
154,307,#00307,20/07/2019,2019-07-20 00:00:00.000000,15,18,25,32,42,52,10,15 18 25 32 42 52,99612417000,1,8037765200,2
155,306,#00306,18/07/2019,2019-07-18 00:00:00.000000,04,24,29,31,39,41,38,04 24 29 31 39 41,97303702800,0,3762358800,0
156,305,#00305,16/07/2019,2019-07-16 00:00:00.000000,04,12,19,31,33,40,51,04 12 19 31 33 40,94600472250,0,3461999850,0
157,304,#00304,13/07/2019,2019-07-13 00:00:00.000000,05,23,29,45,50,52,01,05 23 29 45 50 52,92278133400,0,3203962200,0
158,303,#00303,11/07/2019,2019-07-11 00:00:00.000000,06,09,15,26,35,38,34,06 09 15 26 35 38,90442473600,0,4368840150,1
159,302,#00302,09/07/2019,2019-07-09 00:00:00.000000,04,17,25,40,42,51,02,04 17 25 40 42 51,88891229550,0,4196479700,0
160,301,#00301,06/07/2019,2019-07-06 00:00:00.000000,05,29,36,39,46,53,48,05 29 36 39 46 53,86460678750,0,3926418500,0
161,300,#00300,04/07/2019,2019-07-04 00:00:00.000000,04,05,14,46,52,54,03,04 05 14 46 52 54,84311080050,0,3687574200,0
162,299,#00299,02/07/2019,2019-07-02 00:00:00.000000,02,09,33,45,52,54,01,02 09 33 45 52 54,82181480700,0,3450952050,0
163,298,#00298,29/06/2019,2019-06-29 00:00:00.000000,06,10,19,31,34,43,37,06 10 19 31 34 43,79909429350,0,3198501900,0
164,297,#00297,27/06/2019,2019-06-27 00:00:00.000000,09,29,32,44,49,53,05,09 29 32 44 49 53,78122912250,0,4530368650,1
165,296,#00296,25/06/2019,2019-06-25 00:00:00.000000,03,14,34,35,40,49,23,03 14 34 35 40 49,76160770950,0,4312352950,0
166,295,#00295,22/06/2019,2019-06-22 00:00:00.000000,01,09,23,28,42,54,49,01 09 23 28 42 54,73896412800,0,4060757600,0
167,294,#00294,20/06/2019,2019-06-20 00:00:00.000000,09,15,23,41,49,51,52,09 15 23 41 49 51,71915836350,0,3840693550,0
168,293,#00293,18/06/2019,2019-06-18 00:00:00.000000,24,31,45,46,47,54,04,24 31 45 46 47 54,70095625050,0,3638447850,0
169,292,#00292,15/06/2019,2019-06-15 00:00:00.000000,13,23,40,45,52,55,09,13 23 40 45 52 55,67915717950,0,3396235950,0
170,291,#00291,13/06/2019,2019-06-13 00:00:00.000000,06,09,15,22,29,53,25,06 09 15 22 29 53,65946387450,0,3177421450,0
171,290,#00290,11/06/2019,2019-06-11 00:00:00.000000,02,05,13,20,30,49,35,02 05 13 20 30 49,64349594400,0,4397402900,1
172,289,#00289,08/06/2019,2019-06-08 00:00:00.000000,02,08,10,23,27,35,47,02 08 10 23 27 35,62484145050,0,4190130750,0
173,288,#00288,06/06/2019,2019-06-06 00:00:00.000000,10,13,30,36,51,54,16,10 13 30 36 51 54,60811500000,0,4004281300,0
174,287,#00287,04/06/2019,2019-06-04 00:00:00.000000,18,20,24,26,33,41,55,18 20 24 26 33 41,59020828950,0,3805317850,0
175,286,#00286,01/06/2019,2019-06-01 00:00:00.000000,10,24,31,41,42,47,20,10 24 31 41 42 47,56962077600,0,3576567700,0
176,285,#00285,30/05/2019,2019-05-30 00:00:00.000000,17,31,33,34,37,40,35,17 31 33 34 37 40,55166476800,0,3377056500,0
177,284,#00284,28/05/2019,2019-05-28 00:00:00.000000,15,22,31,32,33,37,51,15 22 31 32 33 37,53501940750,0,3192108050,0
178,283,#00283,25/05/2019,2019-05-25 00:00:00.000000,04,12,35,44,50,55,19,04 12 35 44 50 55,51772968300,0,4511876700,1
179,282,#00282,23/05/2019,2019-05-23 00:00:00.000000,13,21,33,42,53,55,44,13 21 33 42 53 55,50248806150,0,4342525350,0
180,281,#00281,21/05/2019,2019-05-21 00:00:00.000000,11,12,29,31,37,53,41,11 12 29 31 37 53,48503567100,0,4148609900,0
181,280,#00280,18/05/2019,2019-05-18 00:00:00.000000,06,10,13,18,29,38,53,06 10 13 18 29 38,46636259700,0,3941131300,0
182,279,#00279,16/05/2019,2019-05-16 00:00:00.000000,08,28,30,33,40,43,24,08 28 30 33 40 43,45292760400,0,3791853600,0
183,278,#00278,14/05/2019,2019-05-14 00:00:00.000000,06,11,15,21,30,40,10,06 11 15 21 30 40,43647956850,0,3609097650,0
184,277,#00277,11/05/2019,2019-05-11 00:00:00.000000,06,11,20,22,26,28,36,06 11 20 22 26 28,42030094350,0,3429335150,0
185,276,#00276,09/05/2019,2019-05-09 00:00:00.000000,19,21,48,49,54,55,27,19 21 48 49 54 55,40648074600,0,3275777400,0
186,275,#00275,07/05/2019,2019-05-07 00:00:00.000000,03,06,07,08,09,49,24,03 06 07 08 09 49,39120897000,0,3106091000,0
187,274,#00274,04/05/2019,2019-05-04 00:00:00.000000,01,02,03,17,26,53,50,01 02 03 17 26 53,38166078000,0,3907342000,1
188,273,#00273,02/05/2019,2019-05-02 00:00:00.000000,02,10,16,17,33,36,20,02 10 16 17 33 36,36699868650,0,3744429850,0
189,272,#00272,30/04/2019,2019-04-30 00:00:00.000000,03,05,13,40,41,45,52,03 05 13 40 41 45,35412222450,0,3601358050,0
190,271,#00271,27/04/2019,2019-04-27 00:00:00.000000,01,11,22,26,33,51,04,01 11 22 26 33 51,34252173750,0,3472463750,0
191,270,#00270,25/04/2019,2019-04-25 00:00:00.000000,16,22,23,33,36,38,45,16 22 23 33 36 38,32860128000,0,3317792000,0
192,269,#00269,23/04/2019,2019-04-23 00:00:00.000000,20,21,22,31,43,45,30,20 21 22 31 43 45,31616504400,0,3179611600,0
193,268,#00268,20/04/2019,2019-04-20 00:00:00.000000,08,10,12,24,40,44,51,08 10 12 24 40 44,119957842650,1,4699731700,1
194,267,#00267,18/04/2019,2019-04-18 00:00:00.000000,07,08,15,24,26,48,10,07 08 15 24 26 48,117272637300,0,4401375550,0
195,266,#00266,16/04/2019,2019-04-16 00:00:00.000000,16,29,32,33,52,53,05,16 29 32 33 52 53,114222823500,0,4062507350,0
196,265,#00265,13/04/2019,2019-04-13 00:00:00.000000,09,13,20,21,36,43,32,09 13 20 21 36 43,110883292950,0,3691448400,0
197,264,#00264,11/04/2019,2019-04-11 00:00:00.000000,01,08,31,32,37,55,53,01 08 31 32 37 55,107805747000,0,3349498850,0
198,263,#00263,09/04/2019,2019-04-09 00:00:00.000000,10,14,19,36,48,49,03,10 14 19 36 48 49,104660257350,0,3705261050,1
199,262,#00262,06/04/2019,2019-04-06 00:00:00.000000,01,20,30,41,46,50,48,01 20 30 41 46 50,101454269700,0,3349040200,0
200,261,#00261,04/04/2019,2019-04-04 00:00:00.000000,16,26,29,38,47,51,13,16 26 29 38 47 51,98312907900,0,3597381000,1
201,260,#00260,02/04/2019,2019-04-02 00:00:00.000000,01,04,09,20,22,26,48,01 04 09 20 22 26,95702711250,0,3307359150,0
202,259,#00259,30/03/2019,2019-03-30 00:00:00.000000,03,15,18,35,50,54,32,03 15 18 35 50 54,92936478900,0,3564575350,1
203,258,#00258,28/03/2019,2019-03-28 00:00:00.000000,03,23,37,43,44,49,27,03 23 37 43 44 49,90282744300,0,3269715950,0
204,257,#00257,26/03/2019,2019-03-26 00:00:00.000000,15,19,28,40,44,48,14,15 19 28 40 44 48,87855300750,0,4377501800,1
205,256,#00256,23/03/2019,2019-03-23 00:00:00.000000,03,09,30,41,46,52,22,03 09 30 41 46 52,85400833350,0,4104783200,0
206,255,#00255,21/03/2019,2019-03-21 00:00:00.000000,07,18,32,42,46,53,28,07 18 32 42 46 53,82774946550,0,3813018000,0
207,254,#00254,19/03/2019,2019-03-19 00:00:00.000000,08,28,32,35,40,45,34,08 28 32 35 40 45,80316793200,0,3539889850,0
208,253,#00253,16/03/2019,2019-03-16 00:00:00.000000,10,18,22,24,35,40,53,10 18 22 24 35 40,77924209350,0,3274047200,0
209,252,#00252,14/03/2019,2019-03-14 00:00:00.000000,18,21,25,35,44,53,04,18 21 25 35 44 53,75457784550,0,3267720100,1
210,251,#00251,12/03/2019,2019-03-12 00:00:00.000000,09,16,26,34,44,49,19,09 16 26 34 44 49,73048303650,0,3293307650,1
211,250,#00250,09/03/2019,2019-03-09 00:00:00.000000,18,24,31,34,35,44,52,18 24 31 34 35 44,70408534800,0,3917427600,1
212,249,#00249,07/03/2019,2019-03-07 00:00:00.000000,02,14,20,33,41,47,27,02 14 20 33 41 47,68424485250,0,3696977650,0
213,248,#00248,05/03/2019,2019-03-05 00:00:00.000000,01,15,23,51,53,55,26,01 15 23 51 53 55,66291315150,0,3459958750,0
214,247,#00247,02/03/2019,2019-03-02 00:00:00.000000,01,02,03,20,46,48,31,01 02 03 20 46 48,64196433750,0,3227194150,0
215,246,#00246,28/02/2019,2019-02-28 00:00:00.000000,04,15,19,34,40,42,49,04 15 19 34 40 42,62151686400,0,3659927700,1
216,245,#00245,26/02/2019,2019-02-26 00:00:00.000000,08,09,16,34,42,43,45,08 09 16 34 42 43,60260695050,0,3449817550,0
217,244,#00244,23/02/2019,2019-02-23 00:00:00.000000,16,19,30,39,43,52,21,16 19 30 39 43 52,58168007850,0,3217296750,0
218,243,#00243,21/02/2019,2019-02-21 00:00:00.000000,03,10,11,15,29,34,50,03 10 11 15 29 34,56212337100,0,6360507100,1
219,242,#00242,19/02/2019,2019-02-19 00:00:00.000000,12,18,22,29,32,52,51,12 18 22 29 32 52,54466250250,0,6166497450,0
220,241,#00241,16/02/2019,2019-02-16 00:00:00.000000,05,08,14,28,37,40,41,05 08 14 28 37 40,52474074150,0,5945144550,0
221,240,#00240,14/02/2019,2019-02-14 00:00:00.000000,08,15,26,41,43,53,46,08 15 26 41 43 53,50622710700,0,5739437500,0
222,239,#00239,12/02/2019,2019-02-12 00:00:00.000000,01,12,17,34,48,49,47,01 12 17 34 48 49,48334463400,0,5485187800,0
223,238,#00238,09/02/2019,2019-02-09 00:00:00.000000,02,14,15,44,46,50,18,02 14 15 44 46 50,46036778250,0,5229889450,0
224,237,#00237,07/02/2019,2019-02-07 00:00:00.000000,20,27,28,32,47,50,41,20 27 28 32 47 50,44397880500,0,5047789700,0
225,236,#00236,02/02/2019,2019-02-02 00:00:00.000000,11,23,27,35,36,46,37,11 23 27 35 36 46,42935678850,0,4885322850,0
226,235,#00235,31/01/2019,2019-01-31 00:00:00.000000,10,19,20,28,34,44,29,10 19 20 28 34 44,41293427700,0,4702850500,0
227,234,#00234,29/01/2019,2019-01-29 00:00:00.000000,15,20,26,41,45,55,10,15 20 26 41 45 55,39668776950,0,4522333750,0
228,233,#00233,26/01/2019,2019-01-26 00:00:00.000000,20,27,33,43,53,54,48,20 27 33 43 53 54,37689645000,0,4302430200,0
229,232,#00232,24/01/2019,2019-01-24 00:00:00.000000,31,35,38,44,49,55,24,31 35 38 44 49 55,36240081150,0,4141367550,0
230,231,#00231,22/01/2019,2019-01-22 00:00:00.000000,01,14,22,40,52,55,21,01 14 22 40 52 55,34615289550,0,3960835150,0
231,230,#00230,19/01/2019,2019-01-19 00:00:00.000000,13,29,42,46,51,53,36,13 29 42 46 51 53,32903474700,0,3770633500,0
232,229,#00229,17/01/2019,2019-01-17 00:00:00.000000,13,14,22,34,35,55,54,13 14 22 34 35 55,31343414700,0,3597293500,0
233,228,#00228,15/01/2019,2019-01-15 00:00:00.000000,04,06,13,22,29,30,52,04 06 13 22 29 30,77234333700,1,3448025200,0
234,227,#00227,12/01/2019,2019-01-12 00:00:00.000000,07,13,14,26,42,54,11,07 13 14 26 42 54,74780896800,0,3175421100,0
235,226,#00226,10/01/2019,2019-01-10 00:00:00.000000,12,22,31,35,40,47,08,12 22 31 35 40 47,73202106900,0,3519027500,1
236,225,#00225,08/01/2019,2019-01-08 00:00:00.000000,03,05,09,11,45,48,40,03 05 09 11 45 48,70875624450,0,3260529450,0
237,224,#00224,05/01/2019,2019-01-05 00:00:00.000000,10,11,38,47,53,55,51,10 11 38 47 53 55,68530859400,0,3451848750,1
238,223,#00223,03/01/2019,2019-01-03 00:00:00.000000,23,31,37,45,49,54,18,23 31 37 45 49 54,66387325800,0,3213678350,0
239,222,#00222,01/01/2019,2019-01-01 00:00:00.000000,02,19,21,27,37,46,12,02 19 21 27 37 46,64464220650,0,3655801500,1
240,221,#00221,29/12/2018,2018-12-29 00:00:00.000000,08,36,42,43,50,52,30,08 36 42 43 50 52,62343118200,0,3420123450,0
241,220,#00220,27/12/2018,2018-12-27 00:00:00.000000,05,20,33,42,43,50,40,05 20 33 42 43 50,60350101500,0,3198677150,0
242,219,#00219,25/12/2018,2018-12-25 00:00:00.000000,03,09,17,21,23,51,15,03 09 17 21 23 51,58562007150,0,3763148550,1
243,218,#00218,22/12/2018,2018-12-22 00:00:00.000000,03,08,16,35,39,52,29,03 08 16 35 39 52,56763061950,0,3563265750,0
244,217,#00217,20/12/2018,2018-12-20 00:00:00.000000,08,17,24,33,34,44,55,08 17 24 33 34 44,55116976800,0,3380367400,0
245,216,#00216,18/12/2018,2018-12-18 00:00:00.000000,01,09,15,17,25,26,08,01 09 15 17 25 26,53457332700,0,3195962500,0
246,215,#00215,15/12/2018,2018-12-15 00:00:00.000000,14,17,49,52,53,55,12,14 17 49 52 53 55,51693670200,0,4500296150,1
247,214,#00214,13/12/2018,2018-12-13 00:00:00.000000,02,11,14,36,49,55,53,02 11 14 36 49 55,49539451350,0,4260938500,0
248,213,#00213,11/12/2018,2018-12-11 00:00:00.000000,01,05,11,37,39,44,31,01 05 11 37 39 44,47620664400,0,4047739950,0
249,212,#00212,08/12/2018,2018-12-08 00:00:00.000000,03,06,09,31,48,54,53,03 06 09 31 48 54,45711703650,0,3835633200,0
250,211,#00211,06/12/2018,2018-12-06 00:00:00.000000,09,13,23,27,39,42,49,09 13 23 27 39 42,43892386050,0,3633486800,0
251,210,#00210,04/12/2018,2018-12-04 00:00:00.000000,10,13,16,23,30,49,24,10 13 16 23 30 49,42768578550,0,3508619300,0
252,209,#00209,01/12/2018,2018-12-01 00:00:00.000000,03,05,12,20,25,33,41,03 05 12 20 25 33,40936775250,0,3305085600,0
253,208,#00208,29/11/2018,2018-11-29 00:00:00.000000,10,23,27,42,51,52,20,10 23 27 42 51 52,39994410450,0,3200378400,0
254,207,#00207,27/11/2018,2018-11-27 00:00:00.000000,03,05,23,28,35,44,08,03 05 23 28 35 44,38191004850,0,3290607600,1
255,206,#00206,24/11/2018,2018-11-24 00:00:00.000000,03,10,11,25,40,54,17,03 10 11 25 40 54,36820442100,0,3138322850,0
256,205,#00205,22/11/2018,2018-11-22 00:00:00.000000,17,22,24,28,37,44,06,17 22 24 28 37 44,35575536450,0,3984511300,1
257,204,#00204,20/11/2018,2018-11-20 00:00:00.000000,09,23,33,40,44,49,17,09 23 33 40 44 49,34256649000,0,3837968250,0
258,203,#00203,17/11/2018,2018-11-17 00:00:00.000000,12,22,26,29,45,47,15,12 22 26 29 45 47,32831024250,0,3679565500,0
259,202,#00202,15/11/2018,2018-11-15 00:00:00.000000,13,16,21,40,49,52,54,13 16 21 40 49 52,31465133850,0,3527799900,0
260,201,#00201,13/11/2018,2018-11-13 00:00:00.000000,03,25,26,32,41,47,05,03 25 26 32 41 47,41305528200,1,3365007250,0
261,200,#00200,10/11/2018,2018-11-10 00:00:00.000000,03,05,19,22,29,39,15,03 05 19 22 29 39,39307347750,0,3142987200,0
262,199,#00199,08/11/2018,2018-11-08 00:00:00.000000,22,28,31,39,52,53,14,22 28 31 39 52 53,38020462950,0,5236233250,1
263,198,#00198,06/11/2018,2018-11-06 00:00:00.000000,19,22,23,43,47,53,03,19 22 23 43 47 53,36334813350,0,5048938850,0
264,197,#00197,03/11/2018,2018-11-03 00:00:00.000000,14,17,20,23,25,45,34,14 17 20 23 25 45,34340501100,0,4827348600,0
265,196,#00196,01/11/2018,2018-11-01 00:00:00.000000,03,11,15,42,44,54,41,03 11 15 42 44 54,32839102200,0,4660526500,0
266,195,#00195,30/10/2018,2018-10-30 00:00:00.000000,01,12,22,27,30,39,46,01 12 22 27 30 39,31358509500,0,4496016200,0
267,194,#00194,27/10/2018,2018-10-27 00:00:00.000000,08,09,15,21,44,49,16,08 09 15 21 44 49,96756562650,1,4345070700,0
268,193,#00193,25/10/2018,2018-10-25 00:00:00.000000,16,23,29,31,45,48,19,16 23 29 31 45 48,94362451050,0,4079058300,0
269,192,#00192,23/10/2018,2018-10-23 00:00:00.000000,01,03,06,13,21,30,36,01 03 06 13 21 30,91712411850,0,3784609500,0
270,191,#00191,20/10/2018,2018-10-20 00:00:00.000000,02,05,10,17,35,41,21,02 05 10 17 35 41,89122986750,0,3496895600,0
271,190,#00190,18/10/2018,2018-10-18 00:00:00.000000,01,11,22,34,42,47,30,01 11 22 34 42 47,86856031200,0,3245011650,0
272,189,#00189,16/10/2018,2018-10-16 00:00:00.000000,05,28,29,34,42,46,17,05 28 29 34 42 46,84650926350,0,9867003000,2
273,188,#00188,13/10/2018,2018-10-13 00:00:00.000000,12,21,23,44,47,48,43,12 21 23 44 47 48,82070152050,0,4646748800,0
274,187,#00187,11/10/2018,2018-10-11 00:00:00.000000,05,16,17,37,46,49,35,05 16 17 37 46 49,79704990300,0,4383953050,0
275,186,#00186,09/10/2018,2018-10-09 00:00:00.000000,10,27,46,50,51,55,01,10 27 46 50 51 55,77724187950,0,4163863900,0
276,185,#00185,06/10/2018,2018-10-06 00:00:00.000000,05,06,16,42,48,51,03,05 06 16 42 48 51,75218555100,0,3885460250,0
277,184,#00184,04/10/2018,2018-10-04 00:00:00.000000,03,09,12,17,34,42,46,03 09 12 17 34 42,72901033500,0,3627957850,0
278,183,#00183,02/10/2018,2018-10-02 00:00:00.000000,03,07,28,32,33,37,22,03 07 28 32 33 37,71233011300,0,3442622050,0
279,182,#00182,29/09/2018,2018-09-29 00:00:00.000000,03,07,12,32,34,55,38,03 07 12 32 34 55,69155020650,0,3211734200,0
280,181,#00181,27/09/2018,2018-09-27 00:00:00.000000,08,12,29,35,51,54,34,08 12 29 35 51 54,67249412850,0,3213103350,1
281,180,#00180,25/09/2018,2018-09-25 00:00:00.000000,02,03,06,13,14,17,09,02 03 06 13 14 17,65331482700,0,3884290450,1
282,179,#00179,22/09/2018,2018-09-22 00:00:00.000000,01,08,17,28,40,50,21,01 08 17 28 40 50,63494160150,0,3680143500,0
283,178,#00178,20/09/2018,2018-09-20 00:00:00.000000,03,32,35,46,47,49,51,03 32 35 46 47 49,61507022700,0,3459350450,0
284,177,#00177,18/09/2018,2018-09-18 00:00:00.000000,08,21,32,43,48,53,38,08 21 32 43 48 53,59535024150,0,3240239500,0
285,176,#00176,15/09/2018,2018-09-15 00:00:00.000000,02,05,28,30,46,50,49,02 05 28 30 46 50,57372868650,0,5333582600,1
286,175,#00175,13/09/2018,2018-09-13 00:00:00.000000,04,06,07,26,40,44,09,04 06 07 26 40 44,55368863400,0,5110915350,0
287,174,#00174,11/09/2018,2018-09-11 00:00:00.000000,13,17,28,42,45,49,50,13 17 28 42 45 49,53696842500,0,4925135250,0
288,173,#00173,08/09/2018,2018-09-08 00:00:00.000000,09,11,12,24,35,43,15,09 11 12 24 35 43,51566176200,0,4688394550,0
289,172,#00172,06/09/2018,2018-09-06 00:00:00.000000,04,11,15,21,24,27,07,04 11 15 21 24 27,49962814050,0,4510243200,0
290,171,#00171,04/09/2018,2018-09-04 00:00:00.000000,08,18,20,29,34,37,51,08 18 20 29 34 37,48210550500,0,4315547250,0
291,170,#00170,01/09/2018,2018-09-01 00:00:00.000000,02,08,20,21,28,36,05,02 08 20 21 28 36,46296717600,0,4102899150,0
292,169,#00169,30/08/2018,2018-08-30 00:00:00.000000,05,22,28,42,49,54,36,05 22 28 42 49 54,44848312950,0,3941965300,0
293,168,#00168,28/08/2018,2018-08-28 00:00:00.000000,02,10,15,31,39,48,23,02 10 15 31 39 48,43233200400,0,3762508350,0
294,167,#00167,25/08/2018,2018-08-25 00:00:00.000000,10,11,15,32,40,48,27,10 11 15 32 40 48,41260462050,0,3543315200,0
295,166,#00166,23/08/2018,2018-08-23 00:00:00.000000,14,18,27,38,39,53,02,14 18 27 38 39 53,39404614350,0,3337109900,0
296,165,#00165,21/08/2018,2018-08-21 00:00:00.000000,09,12,14,23,32,46,31,09 12 14 23 32 46,38068041000,0,3188601750,0
297,164,#00164,18/08/2018,2018-08-18 00:00:00.000000,07,33,36,39,51,55,11,07 33 36 39 51 55,36370625250,0,3156157700,1
298,163,#00163,16/08/2018,2018-08-16 00:00:00.000000,06,10,34,46,48,51,47,06 10 34 46 48 51,34965205950,0,3140259400,1
299,162,#00162,14/08/2018,2018-08-14 00:00:00.000000,29,30,36,38,45,52,46,29 30 36 38 45 52,33702871350,0,3596064250,1
300,161,#00161,11/08/2018,2018-08-11 00:00:00.000000,16,17,31,33,42,44,14,16 17 31 33 42 44,32194626150,0,3428481450,0
301,160,#00160,09/08/2018,2018-08-09 00:00:00.000000,24,29,32,33,49,55,09,24 29 32 33 49 55,31059648300,0,3302372800,0
302,159,#00159,07/08/2018,2018-08-07 00:00:00.000000,03,09,15,20,39,49,04,03 09 15 20 39 49,47175342150,1,3184634100,0
303,158,#00158,04/08/2018,2018-08-04 00:00:00.000000,11,12,24,32,41,48,03,11 12 24 32 41 48,45513635250,0,3631662050,1
304,157,#00157,02/08/2018,2018-08-02 00:00:00.000000,06,11,16,17,41,55,07,06 11 16 17 41 55,43671479700,0,3426978100,0
305,156,#00156,31/07/2018,2018-07-31 00:00:00.000000,01,05,27,31,47,50,41,01 05 27 31 47 50,41892910050,0,3229359250,0
306,155,#00155,28/07/2018,2018-07-28 00:00:00.000000,11,16,22,25,30,40,09,11 16 22 25 30 40,39828676800,0,4683462000,1
307,154,#00154,26/07/2018,2018-07-26 00:00:00.000000,21,24,33,37,40,46,52,21 24 33 37 40 46,38113527900,0,4492889900,0
308,153,#00153,24/07/2018,2018-07-24 00:00:00.000000,11,18,34,37,50,53,20,11 18 34 37 50 53,36779450250,0,4344659050,0
309,152,#00152,21/07/2018,2018-07-21 00:00:00.000000,07,31,33,37,46,52,28,07 31 33 37 46 52,34751723250,0,4119356050,0
310,151,#00151,19/07/2018,2018-07-19 00:00:00.000000,11,13,28,34,44,47,10,11 13 28 34 44 47,33072762000,0,3932804800,0
311,150,#00150,17/07/2018,2018-07-17 00:00:00.000000,05,14,22,27,31,40,48,05 14 22 27 31 40,31660230900,0,3775856900,0
312,149,#00149,14/07/2018,2018-07-14 00:00:00.000000,04,19,23,34,38,50,01,04 19 23 34 38 50,47012873700,1,3591386800,0
313,148,#00148,12/07/2018,2018-07-12 00:00:00.000000,08,15,18,21,24,49,22,08 15 18 21 24 49,45034013550,0,3371513450,0
314,147,#00147,10/07/2018,2018-07-10 00:00:00.000000,06,10,16,20,27,29,24,06 10 16 20 27 29,43270472550,0,3175564450,0
315,146,#00146,07/07/2018,2018-07-07 00:00:00.000000,02,30,45,48,49,53,41,02 30 45 48 49 53,41690392500,0,3939988950,1
316,145,#00145,05/07/2018,2018-07-05 00:00:00.000000,04,15,22,24,43,51,48,04 15 22 24 43 51,39908934300,0,3742049150,0
317,144,#00144,03/07/2018,2018-07-03 00:00:00.000000,30,32,34,47,48,49,50,30 32 34 47 48 49,38162758350,0,3548029600,0
318,143,#00143,30/06/2018,2018-06-30 00:00:00.000000,03,12,23,24,30,33,01,03 12 23 24 30 33,36351516000,0,3346780450,0
319,142,#00142,28/06/2018,2018-06-28 00:00:00.000000,11,31,33,43,48,51,23,11 31 33 43 48 51,34769813250,0,3171035700,0
320,141,#00141,26/06/2018,2018-06-26 00:00:00.000000,17,18,21,39,40,43,03,17 18 21 39 40 43,33230491950,0,7937664000,2
321,140,#00140,23/06/2018,2018-06-23 00:00:00.000000,06,08,13,23,46,55,01,06 08 13 23 46 55,31562051700,0,3783449750,0
322,139,#00139,21/06/2018,2018-06-21 00:00:00.000000,02,08,19,23,25,33,32,02 08 19 23 25 33,44151049200,1,3609888450,0
323,138,#00138,19/06/2018,2018-06-19 00:00:00.000000,16,17,31,37,41,52,34,16 17 31 37 41 52,42685218300,0,3447018350,0
324,137,#00137,16/06/2018,2018-06-16 00:00:00.000000,14,15,21,30,44,47,48,14 15 21 30 44 47,40558167300,0,3210679350,0
325,136,#00136,14/06/2018,2018-06-14 00:00:00.000000,03,15,32,45,48,54,55,03 15 32 45 48 54,38662053150,0,4150397100,1
326,135,#00135,12/06/2018,2018-06-12 00:00:00.000000,04,13,23,27,29,35,14,04 13 23 27 29 35,36793704900,0,3942802850,0
327,134,#00134,09/06/2018,2018-06-09 00:00:00.000000,09,23,25,39,52,53,38,09 23 25 39 52 53,35057037900,0,3749839850,0
328,133,#00133,07/06/2018,2018-06-07 00:00:00.000000,11,16,18,26,46,47,42,11 16 18 26 46 47,33451356000,0,3571430750,0
329,132,#00132,05/06/2018,2018-06-05 00:00:00.000000,11,21,26,32,51,52,05,11 21 26 32 51 52,31656701100,0,3372024650,0
330,131,#00131,02/06/2018,2018-06-02 00:00:00.000000,05,07,17,22,32,33,06,05 07 17 22 32 33,40421556750,1,3187946750,0
331,130,#00130,31/05/2018,2018-05-31 00:00:00.000000,03,15,18,25,26,29,19,03 15 18 25 26 29,38730036000,0,3772192400,1
332,129,#00129,29/05/2018,2018-05-29 00:00:00.000000,09,13,17,18,46,50,26,09 13 17 18 46 50,37041107700,0,3584533700,0
333,128,#00128,26/05/2018,2018-05-26 00:00:00.000000,07,12,28,31,40,44,15,07 12 28 31 40 44,35144050350,0,3373749550,0
334,127,#00127,24/05/2018,2018-05-24 00:00:00.000000,24,25,26,29,36,48,40,24 25 26 29 36 48,33284469900,0,3167129500,0
335,126,#00126,22/05/2018,2018-05-22 00:00:00.000000,04,05,08,17,35,47,39,04 05 08 17 35 47,31780304400,0,3647009800,1
336,125,#00125,19/05/2018,2018-05-19 00:00:00.000000,33,35,45,52,53,55,25,33 35 45 52 53 55,42114151200,1,3449198200,0
337,124,#00124,17/05/2018,2018-05-17 00:00:00.000000,13,31,38,45,53,55,46,13 31 38 45 53 55,40161824400,0,3232273000,0
338,123,#00123,15/05/2018,2018-05-15 00:00:00.000000,03,06,29,37,44,49,24,03 06 29 37 44 49,38071367400,0,4330115250,1
339,122,#00122,12/05/2018,2018-05-12 00:00:00.000000,01,09,26,38,54,55,51,01 09 26 38 54 55,35643065250,0,4060303900,0
340,121,#00121,10/05/2018,2018-05-10 00:00:00.000000,02,06,08,34,39,43,11,02 06 08 34 39 43,33632951700,0,3836957950,0
341,120,#00120,08/05/2018,2018-05-08 00:00:00.000000,03,16,23,24,38,42,48,03 16 23 24 38 42,31688034150,0,3620856000,0
342,119,#00119,05/05/2018,2018-05-05 00:00:00.000000,16,32,33,37,40,48,15,16 32 33 37 40 48,303899669850,1,3433296650,0
343,118,#00118,03/05/2018,2018-05-03 00:00:00.000000,23,27,33,37,39,49,44,23 27 33 37 39 49,300000000000,0,36846222000,1
344,117,#00117,01/05/2018,2018-05-01 00:00:00.000000,01,07,20,23,25,38,14,01 07 20 23 25 38,323711172750,0,5634574750,0
345,116,#00116,28/04/2018,2018-04-28 00:00:00.000000,12,19,22,29,32,46,25,12 19 22 29 32 46,317750310300,0,4972256700,0
346,115,#00115,26/04/2018,2018-04-26 00:00:00.000000,23,26,29,31,36,54,55,23 26 29 31 36 54,311383703550,0,4264855950,0
347,114,#00114,24/04/2018,2018-04-24 00:00:00.000000,17,18,24,40,41,46,06,17 18 24 40 41 46,305150984400,0,3572331600,0
348,113,#00113,21/04/2018,2018-04-21 00:00:00.000000,16,18,41,43,46,55,35,16 18 41 43 46 55,300000000000,0,7716697000,1
349,112,#00112,19/04/2018,2018-04-19 00:00:00.000000,04,17,19,35,49,55,09,04 17 19 35 49 55,300000000000,0,7032403500,1
350,111,#00111,17/04/2018,2018-04-17 00:00:00.000000,02,10,26,27,31,38,39,02 10 26 27 31 38,300000000000,0,66969623500,1
351,110,#00110,14/04/2018,2018-04-14 00:00:00.000000,02,10,14,26,45,54,20,02 10 14 26 45 54,348542745600,0,8393638400,0
352,109,#00109,12/04/2018,2018-04-12 00:00:00.000000,04,29,35,37,42,54,19,04 29 35 37 42 54,341100719850,0,7566746650,0
353,108,#00108,10/04/2018,2018-04-10 00:00:00.000000,01,22,25,31,36,48,41,01 22 25 31 36 48,333842446200,0,6760271800,0
354,107,#00107,07/04/2018,2018-04-07 00:00:00.000000,12,24,33,34,36,53,05,12 24 33 34 36 53,324541622100,0,5726846900,0
355,106,#00106,05/04/2018,2018-04-05 00:00:00.000000,07,09,17,25,31,32,06,07 09 17 25 31 32,317878643550,0,4986515950,0
356,105,#00105,03/04/2018,2018-04-03 00:00:00.000000,20,21,39,42,51,53,01,20 21 39 42 51 53,311346404850,0,4260711650,0
357,104,#00104,31/03/2018,2018-03-31 00:00:00.000000,03,07,31,43,51,53,26,03 07 31 43 51 53,303276464400,0,3364051600,0
358,103,#00103,29/03/2018,2018-03-29 00:00:00.000000,05,27,35,39,46,52,31,05 27 35 39 46 52,300000000000,0,7207922000,1
359,102,#00102,27/03/2018,2018-03-27 00:00:00.000000,09,13,14,15,54,55,22,09 13 14 15 54 55,300000000000,0,25040212000,1
360,101,#00101,24/03/2018,2018-03-24 00:00:00.000000,01,30,38,45,48,50,12,01 30 38 45 48 50,311943369900,0,4327041100,0
361,100,#00100,22/03/2018,2018-03-22 00:00:00.000000,01,08,24,33,34,41,20,01 08 24 33 34 41,304515142950,0,3501682550,0
362,99,#00099,20/03/2018,2018-03-20 00:00:00.000000,11,40,43,46,49,55,37,11 40 43 46 49 55,300000000000,0,74754860000,2
363,98,#00098,17/03/2018,2018-03-17 00:00:00.000000,03,14,28,35,50,52,29,03 14 28 35 50 52,321738459600,0,5415384400,0
364,97,#00097,15/03/2018,2018-03-15 00:00:00.000000,15,20,23,28,39,49,19,15 20 23 28 39 49,314502409200,0,4611378800,0
365,96,#00096,13/03/2018,2018-03-13 00:00:00.000000,01,02,17,46,47,49,44,01 02 17 46 47 49,306583901400,0,3731544600,0
366,95,#00095,10/03/2018,2018-03-10 00:00:00.000000,09,20,27,31,48,49,42,09 20 27 31 48 49,300000000000,0,70013824500,1
367,94,#00094,08/03/2018,2018-03-08 00:00:00.000000,14,17,18,23,41,52,40,14 17 18 23 41 52,350981591250,0,8664621250,0
368,93,#00093,06/03/2018,2018-03-06 00:00:00.000000,02,06,13,22,40,48,12,02 06 13 22 40 48,342197962500,0,7688662500,0
369,92,#00092,03/03/2018,2018-03-03 00:00:00.000000,04,10,32,37,47,52,49,04 10 32 37 47 52,332230461150,0,6581162350,0
370,91,#00091,01/03/2018,2018-03-01 00:00:00.000000,04,05,07,17,20,38,09,04 05 07 17 20 38,323797375200,0,5644152800,0
371,90,#00090,27/02/2018,2018-02-27 00:00:00.000000,08,16,23,28,44,49,45,08 16 23 28 44 49,315871733550,0,4763525950,0
372,89,#00089,24/02/2018,2018-02-24 00:00:00.000000,05,07,24,32,45,49,01,05 07 24 32 45 49,305600910600,0,3622323400,0
373,88,#00088,22/02/2018,2018-02-22 00:00:00.000000,11,14,32,36,42,48,20,11 14 32 36 42 48,300000000000,0,40973178500,1
374,87,#00087,20/02/2018,2018-02-20 00:00:00.000000,01,02,21,24,50,52,33,01 02 21 24 50 52,324942454200,0,5771383800,0
375,86,#00086,17/02/2018,2018-02-17 00:00:00.000000,16,22,28,29,35,43,45,16 22 28 29 35 43,316828524450,0,4869836050,0
376,85,#00085,13/02/2018,2018-02-13 00:00:00.000000,09,25,26,30,42,54,19,09 25 26 30 42 54,307948444500,0,3883160500,0
377,84,#00084,10/02/2018,2018-02-10 00:00:00.000000,08,10,19,25,36,46,07,08 10 19 25 36 46,300000000000,0,44701261000,2
378,83,#00083,08/02/2018,2018-02-08 00:00:00.000000,21,22,29,37,41,50,33,21 22 29 37 41 50,307756203150,0,3861800350,0
379,82,#00082,06/02/2018,2018-02-06 00:00:00.000000,01,20,29,31,43,53,16,01 20 29 31 43 53,300000000000,0,13248804500,1
380,81,#00081,03/02/2018,2018-02-03 00:00:00.000000,12,29,42,48,54,55,18,12 29 42 48 54 55,300000000000,0,46477663000,2
381,80,#00080,01/02/2018,2018-02-01 00:00:00.000000,01,07,08,09,39,43,52,01 07 08 09 39 43,306891445800,0,3765716200,0
382,79,#00079,30/01/2018,2018-01-30 00:00:00.000000,15,19,24,51,53,55,29,15 19 24 51 53 55,300000000000,0,10505465350,1
383,78,#00078,27/01/2018,2018-01-27 00:00:00.000000,21,26,36,38,40,50,11,21 26 36 38 40 50,290823421800,0,6859255550,0
384,77,#00077,25/01/2018,2018-01-25 00:00:00.000000,01,10,30,44,45,50,04,01 10 30 44 45 50,281341050600,0,5805658750,0
385,76,#00076,23/01/2018,2018-01-23 00:00:00.000000,03,10,15,23,41,53,35,03 10 15 23 41 53,271952211000,0,4762454350,0
386,75,#00075,20/01/2018,2018-01-20 00:00:00.000000,02,07,15,16,41,45,19,02 07 15 16 41 45,262085240100,0,3666124250,0
387,74,#00074,18/01/2018,2018-01-18 00:00:00.000000,12,24,28,30,36,39,15,12 24 28 30 36 39,256090121850,0,5912489850,1
388,73,#00073,16/01/2018,2018-01-16 00:00:00.000000,06,27,33,41,42,49,22,06 27 33 41 42 49,247416944250,0,4948803450,0
389,72,#00072,13/01/2018,2018-01-13 00:00:00.000000,03,21,25,26,51,55,37,03 21 25 26 51 55,236891603100,0,3779321100,0
390,71,#00071,11/01/2018,2018-01-11 00:00:00.000000,04,07,30,35,37,45,01,04 07 30 35 37 45,229877713200,0,3679272900,1
391,70,#00070,09/01/2018,2018-01-09 00:00:00.000000,18,25,28,46,50,51,15,18 25 28 46 50 51,223764257100,0,9639805800,2
392,69,#00069,06/01/2018,2018-01-06 00:00:00.000000,04,11,24,35,41,45,17,04 11 24 35 41 45,213511359900,0,3680692100,0
393,68,#00068,04/01/2018,2018-01-04 00:00:00.000000,01,07,31,35,46,55,51,01 07 31 35 46 55,207385131000,0,13873550250,3
394,67,#00067,02/01/2018,2018-01-02 00:00:00.000000,04,07,08,34,37,47,24,04 07 08 34 37 47,198519424050,0,3639438200,0
395,66,#00066,30/12/2017,2017-12-30 00:00:00.000000,08,09,36,37,39,50,07,08 09 36 37 39 50,192764480250,0,25716957750,3
396,65,#00065,28/12/2017,2017-12-28 00:00:00.000000,07,18,26,29,31,35,34,07 18 26 29 31 35,185756375100,0,7793640900,0
397,64,#00064,26/12/2017,2017-12-26 00:00:00.000000,07,11,13,18,26,42,49,07 11 13 18 26 42,179085637200,0,7052447800,0
398,63,#00063,23/12/2017,2017-12-23 00:00:00.000000,07,08,09,13,28,44,12,07 08 09 13 28 44,172865880750,0,6361363750,0
399,62,#00062,21/12/2017,2017-12-21 00:00:00.000000,22,23,27,35,37,46,19,22 23 27 35 37 46,167473255350,0,5762183150,0
400,61,#00061,19/12/2017,2017-12-19 00:00:00.000000,02,03,20,25,38,44,12,02 03 20 25 38 44,161744780550,0,5125685950,0
401,60,#00060,16/12/2017,2017-12-16 00:00:00.000000,05,23,37,41,43,53,25,05 23 37 41 43 53,155267929650,0,4406035850,0
402,59,#00059,14/12/2017,2017-12-14 00:00:00.000000,11,12,22,28,46,50,07,11 12 22 28 46 50,150431996550,0,3868709950,0
403,58,#00058,12/12/2017,2017-12-12 00:00:00.000000,06,07,08,21,32,39,27,06 07 08 21 32 39,145563767850,0,3327795650,0
404,57,#00057,09/12/2017,2017-12-09 00:00:00.000000,05,34,35,42,49,52,21,05 34 35 42 49 52,142613607000,0,3293227850,1
405,56,#00056,07/12/2017,2017-12-07 00:00:00.000000,03,14,26,35,44,54,25,03 14 26 35 44 54,139974556350,0,4751773250,1
406,55,#00055,05/12/2017,2017-12-05 00:00:00.000000,27,38,40,42,46,55,05,27 38 40 42 46 55,135897635550,0,4298782050,0
407,54,#00054,02/12/2017,2017-12-02 00:00:00.000000,09,37,45,50,53,54,40,09 37 45 50 53 54,130389001500,0,3686711600,0
408,53,#00053,30/11/2017,2017-11-30 00:00:00.000000,05,13,26,37,53,55,28,05 13 26 37 53 55,126430993200,0,3246932900,0
409,52,#00052,28/11/2017,2017-11-28 00:00:00.000000,02,19,39,49,51,53,20,02 19 39 49 51 53,124208597100,0,7385102000,2
410,51,#00051,25/11/2017,2017-11-25 00:00:00.000000,02,09,16,46,52,55,50,02 09 16 46 52 55,120250718850,0,3252786750,0
411,50,#00050,23/11/2017,2017-11-23 00:00:00.000000,01,02,03,18,25,50,14,01 02 03 18 25 50,117975638100,0,3674925400,1
412,49,#00049,21/11/2017,2017-11-21 00:00:00.000000,05,08,23,37,38,54,55,05 08 23 37 38 54,114313083150,0,3267974850,0
413,48,#00048,18/11/2017,2017-11-18 00:00:00.000000,11,12,26,42,50,54,17,11 12 26 42 50 54,111901309500,0,3621198450,1
414,47,#00047,16/11/2017,2017-11-16 00:00:00.000000,01,16,22,25,47,48,21,01 16 22 25 47 48,108584968350,0,3252716100,0
415,46,#00046,14/11/2017,2017-11-14 00:00:00.000000,20,24,29,41,47,49,22,20 24 29 41 47 49,106310523450,0,3610320500,1
416,45,#00045,11/11/2017,2017-11-11 00:00:00.000000,12,26,33,35,36,44,01,12 26 33 35 36 44,102765805950,0,3216463000,0
417,44,#00044,09/11/2017,2017-11-09 00:00:00.000000,02,03,06,23,34,36,50,02 03 06 23 34 36,100817638950,0,5110772400,1
418,43,#00043,07/11/2017,2017-11-07 00:00:00.000000,19,32,36,37,42,54,28,19 32 36 37 42 54,97091932800,0,4696805050,0
419,42,#00042,04/11/2017,2017-11-04 00:00:00.000000,02,08,12,44,46,52,09,02 08 12 44 46 52,93461623500,0,4293437350,0
420,41,#00041,02/11/2017,2017-11-02 00:00:00.000000,03,09,12,21,51,52,07,03 09 12 21 51 52,90407671050,0,3954109300,0
421,40,#00040,31/10/2017,2017-10-31 00:00:00.000000,07,13,24,45,47,52,33,07 13 24 45 47 52,87445250850,0,3624951500,0
422,39,#00039,28/10/2017,2017-10-28 00:00:00.000000,13,18,35,36,41,48,47,13 18 35 36 41 48,85047387150,0,3358522200,0
423,38,#00038,26/10/2017,2017-10-26 00:00:00.000000,02,10,15,30,34,50,03,02 10 15 30 34 50,83506415700,0,3187303150,0
424,37,#00037,24/10/2017,2017-10-24 00:00:00.000000,01,02,09,13,32,35,52,01 02 09 13 32 35,81820687350,0,3199238550,1
425,36,#00036,21/10/2017,2017-10-21 00:00:00.000000,04,09,13,16,18,49,30,04 09 13 16 18 49,80027540400,0,5764145600,1
426,35,#00035,19/10/2017,2017-10-19 00:00:00.000000,06,15,17,24,40,45,39,06 15 17 24 40 45,77375046900,0,5469424100,0
427,34,#00034,17/10/2017,2017-10-17 00:00:00.000000,01,26,36,40,50,54,31,01 26 36 40 50 54,74830295100,0,5186673900,0
428,33,#00033,14/10/2017,2017-10-14 00:00:00.000000,14,18,29,35,44,49,54,14 18 29 35 44 49,72079404600,0,4881019400,0
429,32,#00032,12/10/2017,2017-10-12 00:00:00.000000,05,08,11,31,37,42,52,05 08 11 31 37 42,69615950250,0,4607302250,0
430,31,#00031,10/10/2017,2017-10-10 00:00:00.000000,29,33,43,44,45,50,41,29 33 43 44 45 50,67375253100,0,4358335900,0
431,30,#00030,07/10/2017,2017-10-07 00:00:00.000000,31,34,40,42,43,49,16,31 34 40 42 43 49,64573341150,0,4047012350,0
432,29,#00029,05/10/2017,2017-10-05 00:00:00.000000,01,03,14,19,35,41,20,01 03 14 19 35 41,62814288900,0,3851562100,0
433,28,#00028,03/10/2017,2017-10-03 00:00:00.000000,21,31,35,41,46,50,23,21 31 35 41 46 50,61575921300,0,3713965700,0
434,27,#00027,30/09/2017,2017-09-30 00:00:00.000000,04,17,23,25,34,46,24,04 17 23 25 34 46,60155334750,0,3556122750,0
435,26,#00026,28/09/2017,2017-09-28 00:00:00.000000,20,27,28,31,39,47,10,20 27 28 31 39 47,59174588100,0,3447150900,0
436,25,#00025,26/09/2017,2017-09-26 00:00:00.000000,14,15,18,30,36,49,19,14 15 18 30 36 49,57928236150,0,3308667350,0
437,24,#00024,23/09/2017,2017-09-23 00:00:00.000000,07,08,27,36,44,53,49,07 08 27 36 44 53,56305734600,0,3128389400,0
438,23,#00023,21/09/2017,2017-09-21 00:00:00.000000,09,12,16,24,43,51,39,09 12 16 24 43 51,55150230000,0,5794470000,1
439,22,#00022,19/09/2017,2017-09-19 00:00:00.000000,03,32,36,41,44,53,45,03 32 36 41 44 53,54239944350,0,5693327150,0
440,21,#00021,16/09/2017,2017-09-16 00:00:00.000000,09,12,21,26,29,52,24,09 12 21 26 29 52,53177036250,0,5575226250,0
441,20,#00020,14/09/2017,2017-09-14 00:00:00.000000,22,23,32,43,44,51,15,22 23 32 43 44 51,52263240150,0,5473693350,0
442,19,#00019,12/09/2017,2017-09-12 00:00:00.000000,06,10,12,47,48,51,35,06 10 12 47 48 51,51063730500,0,5340414500,0
443,18,#00018,09/09/2017,2017-09-09 00:00:00.000000,01,15,23,36,43,54,12,01 15 23 36 43 54,49441033650,0,5160114850,0
444,17,#00017,07/09/2017,2017-09-07 00:00:00.000000,04,18,22,31,32,40,08,04 18 22 31 32 40,48190895850,0,5021210650,0
445,16,#00016,05/09/2017,2017-09-05 00:00:00.000000,01,02,08,13,23,39,09,01 02 08 13 23 39,46972594200,0,4885843800,0
446,15,#00015,02/09/2017,2017-09-02 00:00:00.000000,05,09,11,18,19,37,50,05 09 11 18 19 37,45743789550,0,4749309950,0
447,14,#00014,31/08/2017,2017-08-31 00:00:00.000000,08,20,27,35,36,47,18,08 20 27 35 36 47,45086515950,0,4676279550,0
448,13,#00013,29/08/2017,2017-08-29 00:00:00.000000,04,12,15,23,24,41,44,04 12 15 23 24 41,43925548800,0,4547283200,0
449,12,#00012,26/08/2017,2017-08-26 00:00:00.000000,17,25,30,31,36,41,20,17 25 30 31 36 41,42705608250,0,4411734250,0
450,11,#00011,24/08/2017,2017-08-24 00:00:00.000000,05,16,18,37,42,46,10,05 16 18 37 42 46,41355943950,0,4261771550,0
451,10,#00010,22/08/2017,2017-08-22 00:00:00.000000,10,24,31,32,38,44,14,10 24 31 32 38 44,40231270200,0,4136807800,0
452,9,#00009,19/08/2017,2017-08-19 00:00:00.000000,07,11,13,15,26,51,36,07 11 13 15 26 51,38842141350,0,3982460150,0
453,8,#00008,17/08/2017,2017-08-17 00:00:00.000000,11,12,20,30,32,34,53,11 12 20 30 32 34,37754634900,0,3861626100,0
454,7,#00007,15/08/2017,2017-08-15 00:00:00.000000,07,11,19,32,33,51,30,07 11 19 32 33 51,36713676000,0,3745964000,0
455,6,#00006,12/08/2017,2017-08-12 00:00:00.000000,06,16,20,32,38,51,34,06 16 20 32 38 51,35666199750,0,3629577750,0
456,5,#00005,10/08/2017,2017-08-10 00:00:00.000000,10,11,19,41,50,54,03,10 11 19 41 50 54,34588091550,0,3509787950,0
457,4,#00004,08/08/2017,2017-08-08 00:00:00.000000,19,36,39,41,46,51,38,19 36 39 41 46 51,33415353750,0,3379483750,0
458,3,#00003,05/08/2017,2017-08-05 00:00:00.000000,01,05,11,32,40,45,43,01 05 11 32 40 45,31903413600,0,3211490400,0
459,2,#00002,03/08/2017,2017-08-03 00:00:00.000000,04,09,24,25,27,45,40,04 09 24 25 27 45,31024813350,0,3113868150,0
460,1,#00001,01/08/2017,2017-08-01 00:00:00.000000,05,10,14,23,24,38,35,05 10 14 23 24 38,30528493950,0,3058721550,0
461,462,#00462,11/08/2020,2020-08-11 00:00:00.000000,02,12,33,39,52,53,44,02 12 33 39 52 53,37842198150,0,3166395550,0
462,461,#00461,08/08/2020,2020-08-08 00:00:00.000000,03,12,24,26,36,43,08,03 12 24 26 36 43,36344638200,0,3704959800,2
463,460,#00460,06/08/2020,2020-08-06 00:00:00.000000,02,05,21,24,26,27,11,02 05 21 24 26 27,35484039300,0,3609337700,0
464,459,#00459,04/08/2020,2020-08-04 00:00:00.000000,10,15,20,21,32,51,08,10 15 20 21 32 51,34160517300,0,3462279700,0
465,458,#00458,01/08/2020,2020-08-01 00:00:00.000000,13,18,29,30,40,47,04,13 18 29 30 40 47,32664333450,0,3296037050,0
466,457,#00457,30/07/2020,2020-07-30 00:00:00.000000,06,07,16,26,29,54,04,06 07 16 26 29 54,31179786600,0,3131087400,0
467,456,#00456,28/07/2020,2020-07-28 00:00:00.000000,03,11,20,34,44,54,16,03 11 20 34 44 54,108125269950,1,6969310000,1
468,455,#00455,25/07/2020,2020-07-25 00:00:00.000000,02,19,21,34,54,55,24,02 19 21 34 54 55,102347224500,0,6327304950,0
469,454,#00454,23/07/2020,2020-07-23 00:00:00.000000,04,12,31,47,49,52,02,04 12 31 47 49 52,97175363250,0,5752653700,0
470,453,#00453,21/07/2020,2020-07-21 00:00:00.000000,06,14,31,37,38,44,04,06 14 31 37 38 44,91825726800,0,5158249650,0
471,452,#00452,18/07/2020,2020-07-18 00:00:00.000000,03,13,22,28,30,53,16,03 13 22 28 30 53,86441982150,0,4560055800,0
472,451,#00451,16/07/2020,2020-07-16 00:00:00.000000,02,05,11,20,24,32,06,02 05 11 20 24 32,82008822450,0,4067482500,0
473,450,#00450,14/07/2020,2020-07-14 00:00:00.000000,05,22,32,34,43,51,12,05 22 32 34 43 51,77917521900,0,3612893550,0
474,449,#00449,11/07/2020,2020-07-11 00:00:00.000000,03,04,06,14,20,38,35,03 04 06 14 20 38,74543157300,0,3237964150,0
475,448,#00448,09/07/2020,2020-07-09 00:00:00.000000,03,10,11,17,26,54,21,03 10 11 17 26 54,72401479950,0,3472460950,1
476,447,#00447,07/07/2020,2020-07-07 00:00:00.000000,07,24,32,35,48,50,01,07 24 32 35 48 50,70362637500,0,3245922900,0
477,446,#00446,04/07/2020,2020-07-04 00:00:00.000000,03,09,10,18,29,45,36,03 09 10 18 29 45,68149331400,0,3853016050,1
478,445,#00445,02/07/2020,2020-07-02 00:00:00.000000,04,10,20,38,48,53,05,04 10 20 38 48 53,66366603300,0,3654935150,0
479,444,#00444,30/06/2020,2020-06-30 00:00:00.000000,05,11,18,19,20,21,52,05 11 18 19 20 21,64312813650,0,3426736300,0
480,443,#00443,27/06/2020,2020-06-27 00:00:00.000000,02,06,38,47,50,53,14,02 06 38 47 50 53,62496583500,0,3224932950,0
481,442,#00442,25/06/2020,2020-06-25 00:00:00.000000,09,10,12,19,27,40,55,09 10 12 19 27 40,60472186950,0,3613345900,1
482,441,#00441,23/06/2020,2020-06-23 00:00:00.000000,02,18,28,46,52,54,19,02 18 28 46 52 54,58805962050,0,3428209800,0
483,440,#00440,20/06/2020,2020-06-20 00:00:00.000000,05,09,33,43,44,50,46,05 09 33 43 44 50,56914961250,0,3218098600,0
484,439,#00439,18/06/2020,2020-06-18 00:00:00.000000,05,18,27,45,50,54,09,05 18 27 45 50 54,54952073850,0,3122220850,1
485,438,#00438,16/06/2020,2020-06-16 00:00:00.000000,02,15,16,23,33,54,45,02 15 16 23 33 54,53852086200,0,3735115200,1
486,437,#00437,13/06/2020,2020-06-13 00:00:00.000000,07,09,11,30,43,53,10,07 09 11 30 43 53,52151425050,0,3546152850,0
487,436,#00436,11/06/2020,2020-06-11 00:00:00.000000,03,21,25,32,35,52,34,03 21 25 32 35 52,50713813200,0,3386418200,0
488,435,#00435,09/06/2020,2020-06-09 00:00:00.000000,01,03,08,22,42,48,44,01 03 08 22 42 48,49186580250,0,3216725650,0
489,434,#00434,06/06/2020,2020-06-06 00:00:00.000000,08,12,24,32,35,51,21,08 12 24 32 35 51,47236049400,0,7251116250,1
490,433,#00433,04/06/2020,2020-06-04 00:00:00.000000,06,12,16,34,39,54,19,06 12 16 34 39 54,45728364900,0,7083595750,0
491,432,#00432,02/06/2020,2020-06-02 00:00:00.000000,04,19,31,42,48,55,22,04 19 31 42 48 55,44372894250,0,6932987900,0
492,431,#00431,30/05/2020,2020-05-30 00:00:00.000000,12,13,41,42,48,53,20,12 13 41 42 48 53,42364771950,0,6709863200,0
493,430,#00430,28/05/2020,2020-05-28 00:00:00.000000,01,04,08,21,44,49,52,01 04 08 21 44 49,40722802950,0,6527422200,0
494,429,#00429,26/05/2020,2020-05-26 00:00:00.000000,11,12,23,24,34,47,43,11 12 23 24 34 47,39110032200,0,6348225450,0
495,428,#00428,23/05/2020,2020-05-23 00:00:00.000000,04,13,27,47,50,55,31,04 13 27 47 50 55,37457550750,0,6164616400,0
496,427,#00427,21/05/2020,2020-05-21 00:00:00.000000,02,15,22,25,30,46,10,02 15 22 25 30 46,35786056800,0,5978894850,0
497,426,#00426,19/05/2020,2020-05-19 00:00:00.000000,05,15,16,19,49,55,03,05 15 16 19 49 55,34151397600,0,5797266050,0
498,425,#00425,16/05/2020,2020-05-16 00:00:00.000000,19,35,38,49,52,55,01,19 35 38 49 52 55,32685784500,0,5634420150,0
499,424,#00424,14/05/2020,2020-05-14 00:00:00.000000,07,23,29,47,51,55,12,07 23 29 47 51 55,31171245600,0,5466138050,0
500,423,#00423,12/05/2020,2020-05-12 00:00:00.000000,01,08,25,34,38,44,28,01 08 25 34 38 44,192141839100,1,5335999650,0
501,422,#00422,09/05/2020,2020-05-09 00:00:00.000000,18,19,30,39,45,46,11,18 19 30 39 45 46,183593994150,0,4386239100,0
502,421,#00421,07/05/2020,2020-05-07 00:00:00.000000,09,19,28,30,32,54,22,09 19 28 30 32 54,175919619900,0,3533530850,0
503,420,#00420,05/05/2020,2020-05-05 00:00:00.000000,01,04,13,15,18,20,22,01 04 13 15 18 20,171117842250,0,4915251500,1
504,419,#00419,02/05/2020,2020-05-02 00:00:00.000000,02,06,09,16,43,53,19,02 06 09 16 43 53,163627248450,0,4082963300,0
505,418,#00418,30/04/2020,2020-04-30 00:00:00.000000,12,31,32,33,39,41,14,12 31 32 33 39 41,157535203350,0,3406069400,0
506,417,#00417,28/04/2020,2020-04-28 00:00:00.000000,04,06,10,16,30,46,34,04 06 10 16 30 46,153880578750,0,4167848001,3
507,416,#00416,25/04/2020,2020-04-25 00:00:00.000000,04,18,24,30,53,55,13,04 18 24 30 53 55,147103949100,0,3414889150,0
508,415,#00415,31/03/2020,2020-03-31 00:00:00.000000,12,19,40,41,43,53,23,12 19 40 41 43 53,143369946750,0,3643539800,2
509,414,#00414,28/03/2020,2020-03-28 00:00:00.000000,01,10,11,13,27,55,19,01 10 11 13 27 55,137578088550,0,8574074450,1
510,413,#00413,26/03/2020,2020-03-26 00:00:00.000000,07,08,11,31,35,36,45,07 08 11 31 35 36,130391512500,0,7775566000,0
511,412,#00412,24/03/2020,2020-03-24 00:00:00.000000,03,09,20,21,33,52,50,03 09 20 21 33 52,123683187000,0,7030196500,0
512,411,#00411,21/03/2020,2020-03-21 00:00:00.000000,10,12,14,17,29,53,25,10 12 14 17 29 53,116918632650,0,6278579350,0
513,410,#00410,19/03/2020,2020-03-19 00:00:00.000000,03,35,41,42,43,49,31,03 35 41 42 43 49,110372538000,0,5551235500,0
514,409,#00409,17/03/2020,2020-03-17 00:00:00.000000,01,14,18,43,49,50,08,01 14 18 43 49 50,104401521300,0,4887789200,0
515,408,#00408,14/03/2020,2020-03-14 00:00:00.000000,12,20,25,38,39,40,37,12 20 25 38 39 40,98660027100,0,4249845400,0
516,407,#00407,12/03/2020,2020-03-12 00:00:00.000000,02,14,19,24,27,34,48,02 14 19 24 27 34,93827290800,0,3712874700,0
517,406,#00406,10/03/2020,2020-03-10 00:00:00.000000,23,25,30,36,45,52,53,23 25 30 36 45 52,89968227600,0,3284089900,0
518,405,#00405,07/03/2020,2020-03-07 00:00:00.000000,05,11,21,30,40,48,20,05 11 21 30 40 48,87411418500,0,3761291650,1
519,404,#00404,05/03/2020,2020-03-05 00:00:00.000000,08,09,34,40,41,54,13,08 09 34 40 41 54,83145846450,0,3287339200,0
520,403,#00403,03/03/2020,2020-03-03 00:00:00.000000,14,15,31,40,43,49,12,14 15 31 40 43 49,80559793650,0,5964207600,1
521,402,#00402,29/02/2020,2020-02-29 00:00:00.000000,09,17,23,26,51,54,32,09 17 23 26 51 54,75711825300,0,5425544450,0
522,401,#00401,27/02/2020,2020-02-27 00:00:00.000000,03,11,21,29,47,55,50,03 11 21 29 47 55,73148581650,0,5140739600,0
523,400,#00400,25/02/2020,2020-02-25 00:00:00.000000,05,13,21,36,39,48,06,05 13 21 36 39 48,71004697950,0,4902530300,0
524,399,#00399,22/02/2020,2020-02-22 00:00:00.000000,07,24,32,49,51,54,44,07 24 32 49 51 54,68557422900,0,4630610850,0
525,398,#00398,20/02/2020,2020-02-20 00:00:00.000000,01,03,20,33,36,51,49,01 03 20 33 36 51,66299572650,0,4379738600,0
526,397,#00397,18/02/2020,2020-02-18 00:00:00.000000,27,32,36,37,47,48,50,27 32 36 37 47 48,64111378350,0,4136605900,0
527,396,#00396,15/02/2020,2020-02-15 00:00:00.000000,26,36,37,38,42,49,46,26 36 37 38 42 49,61707788850,0,3869540400,0
528,395,#00395,13/02/2020,2020-02-13 00:00:00.000000,25,28,32,34,35,39,07,25 28 32 34 35 39,59497631400,0,3623967350,0
529,394,#00394,11/02/2020,2020-02-11 00:00:00.000000,04,14,18,21,32,53,02,04 14 18 21 32 53,57387718200,0,3389532550,0
530,393,#00393,08/02/2020,2020-02-08 00:00:00.000000,09,12,19,25,41,54,38,09 12 19 25 41 54,55406377200,0,3169383550,0
531,392,#00392,06/02/2020,2020-02-06 00:00:00.000000,13,18,34,36,45,49,37,13 18 34 36 45 49,53881925250,0,3660378200,1
532,391,#00391,04/02/2020,2020-02-04 00:00:00.000000,06,10,20,47,52,55,46,06 10 20 47 52 55,52092567750,0,3461560700,0
533,390,#00390,01/02/2020,2020-02-01 00:00:00.000000,02,03,11,23,35,54,06,02 03 11 23 35 54,49743734700,0,3200579250,0
534,389,#00389,30/01/2020,2020-01-30 00:00:00.000000,12,18,28,30,47,50,41,12 18 28 30 47 50,47938521450,0,3610751850,1
535,388,#00388,28/01/2020,2020-01-28 00:00:00.000000,01,20,24,33,40,55,46,01 20 24 33 40 55,45952786650,0,3390114650,0
536,387,#00387,23/01/2020,2020-01-23 00:00:00.000000,09,15,18,25,31,49,46,09 15 18 25 31 49,44100944850,0,3184354450,0
537,386,#00386,21/01/2020,2020-01-21 00:00:00.000000,14,31,45,47,52,54,13,14 31 45 47 52 54,42441754800,0,6030452650,1
538,385,#00385,18/01/2020,2020-01-18 00:00:00.000000,13,18,19,23,32,43,11,13 18 19 23 32 43,40085895450,0,5768690500,0
539,384,#00384,16/01/2020,2020-01-16 00:00:00.000000,10,11,26,33,44,46,55,10 11 26 33 44 46,38298729900,0,5570116550,0
540,383,#00383,14/01/2020,2020-01-14 00:00:00.000000,03,04,17,39,50,51,53,03 04 17 39 50 51,36634873800,0,5385243650,0
541,382,#00382,11/01/2020,2020-01-11 00:00:00.000000,08,11,17,19,25,47,53,08 11 17 19 25 47,34734762300,0,5174120150,0
542,381,#00381,09/01/2020,2020-01-09 00:00:00.000000,17,20,21,29,52,54,51,17 20 21 29 52 54,33409526250,0,5026871700,0
543,380,#00380,07/01/2020,2020-01-07 00:00:00.000000,08,11,16,22,42,54,13,08 11 16 22 42 54,31673873550,0,4834021400,0
544,379,#00379,04/01/2020,2020-01-04 00:00:00.000000,04,14,26,42,44,55,48,04 14 26 42 44 55,111099202950,1,4648035450,0
545,378,#00378,02/01/2020,2020-01-02 00:00:00.000000,12,14,26,29,33,40,50,12 14 26 29 33 40,108639141150,0,4374695250,0
546,377,#00377,31/12/2019,2019-12-31 00:00:00.000000,02,22,26,28,44,55,27,02 22 26 28 44 55,105104974350,0,3982010050,0
547,376,#00376,28/12/2019,2019-12-28 00:00:00.000000,10,17,26,28,29,32,21,10 17 26 28 29 32,101245855800,0,3553219100,0
548,375,#00375,26/12/2019,2019-12-26 00:00:00.000000,05,06,12,18,23,54,26,05 06 12 18 23 54,98509997550,0,3249234850,0
549,374,#00374,24/12/2019,2019-12-24 00:00:00.000000,03,16,30,34,50,55,48,03 16 30 34 50 55,96266883900,0,4100571850,2
550,373,#00373,21/12/2019,2019-12-21 00:00:00.000000,05,08,20,34,37,42,51,05 08 20 34 37 42,93381149550,0,3779934700,0
551,372,#00372,19/12/2019,2019-12-19 00:00:00.000000,18,22,25,28,29,34,50,18 22 25 28 29 34,91007696550,0,3516217700,0
552,371,#00371,17/12/2019,2019-12-17 00:00:00.000000,04,05,14,19,22,37,43,04 05 14 19 22 37,88681195200,0,3257717550,0
553,370,#00370,14/12/2019,2019-12-14 00:00:00.000000,03,30,33,34,40,47,26,03 30 33 34 40 47,86361737250,0,4724065750,1
554,369,#00369,12/12/2019,2019-12-12 00:00:00.000000,01,09,15,42,49,50,48,01 09 15 42 49 50,83862112800,0,4446329700,0
555,368,#00368,10/12/2019,2019-12-10 00:00:00.000000,05,20,33,42,43,49,26,05 20 33 42 43 49,81294373650,0,4161025350,0
556,367,#00367,07/12/2019,2019-12-07 00:00:00.000000,07,18,38,42,47,51,08,07 18 38 42 47 51,78697118100,0,3872441400,0
557,366,#00366,05/12/2019,2019-12-05 00:00:00.000000,09,11,16,27,35,40,51,09 11 16 27 35 40,76939767750,0,3677180250,0
558,365,#00365,03/12/2019,2019-12-03 00:00:00.000000,21,29,36,41,50,52,42,21 29 36 41 50 52,75051358950,0,3467357050,0
559,364,#00364,30/11/2019,2019-11-30 00:00:00.000000,08,09,10,32,44,50,15,08 09 10 32 44 50,72655918050,0,3201196950,0
560,363,#00363,28/11/2019,2019-11-28 00:00:00.000000,01,18,26,28,53,55,14,01 18 26 28 53 55,70845145500,0,3209152250,1
561,362,#00362,26/11/2019,2019-11-26 00:00:00.000000,07,19,38,41,42,47,04,07 19 38 41 42 47,68962775250,0,14805039150,3
562,361,#00361,23/11/2019,2019-11-23 00:00:00.000000,07,29,30,45,50,55,15,07 29 30 45 50 55,66837919800,0,4698918000,0
563,360,#00360,21/11/2019,2019-11-21 00:00:00.000000,21,24,35,38,42,47,34,21 24 35 38 42 47,64726581900,0,4464324900,0
564,359,#00359,19/11/2019,2019-11-19 00:00:00.000000,19,21,33,35,38,40,04,19 21 33 35 38 40,62562161550,0,4223833750,0
565,358,#00358,16/11/2019,2019-11-16 00:00:00.000000,06,08,18,22,49,52,10,06 08 18 22 49 52,60416984100,0,3985480700,0
566,357,#00357,14/11/2019,2019-11-14 00:00:00.000000,09,12,16,36,41,55,35,09 12 16 36 41 55,58593943200,0,3782920600,0
567,356,#00356,12/11/2019,2019-11-12 00:00:00.000000,10,17,24,27,36,39,33,10 17 24 27 36 39,56779236300,0,3581286500,0
568,355,#00355,09/11/2019,2019-11-09 00:00:00.000000,01,03,06,25,29,41,12,01 03 06 25 29 41,55018617150,0,3385662150,0
569,354,#00354,07/11/2019,2019-11-07 00:00:00.000000,01,12,19,37,44,52,18,01 12 19 37 44 52,53142153150,0,3177166150,0
570,353,#00353,05/11/2019,2019-11-05 00:00:00.000000,03,06,16,17,44,50,28,03 06 16 17 44 50,51547657800,0,5241750900,1
571,352,#00352,02/11/2019,2019-11-02 00:00:00.000000,02,15,34,35,48,50,32,02 15 34 35 48 50,49723313700,0,5039046000,0
572,351,#00351,31/10/2019,2019-10-31 00:00:00.000000,18,19,22,37,47,48,46,18 19 22 37 47 48,48060708600,0,4854312100,0
573,350,#00350,29/10/2019,2019-10-29 00:00:00.000000,12,15,16,31,43,55,11,12 15 16 31 43 55,46241529150,0,4652181050,0
574,349,#00349,26/10/2019,2019-10-26 00:00:00.000000,18,20,22,50,51,53,35,18 20 22 50 51 53,44324971050,0,4439230150,0
575,348,#00348,24/10/2019,2019-10-24 00:00:00.000000,09,14,23,41,45,50,13,09 14 23 41 45 50,42764346750,0,4265827450,0
576,347,#00347,22/10/2019,2019-10-22 00:00:00.000000,02,16,26,27,36,40,31,02 16 26 27 36 40,41541604500,0,4129967200,0
577,346,#00346,19/10/2019,2019-10-19 00:00:00.000000,01,10,21,26,42,43,25,01 10 21 26 42 43,39917681400,0,3949531300,0
578,345,#00345,17/10/2019,2019-10-17 00:00:00.000000,05,11,14,34,51,53,16,05 11 14 34 51 53,38474598450,0,3789188750,0
579,344,#00344,15/10/2019,2019-10-15 00:00:00.000000,09,12,29,46,48,53,03,09 12 29 46 48 53,36880715100,0,3612090600,0
580,343,#00343,12/10/2019,2019-10-12 00:00:00.000000,21,39,48,51,53,55,05,21 39 48 51 53 55,35556777750,0,3464986450,0
581,342,#00342,10/10/2019,2019-10-10 00:00:00.000000,04,17,42,51,53,55,29,04 17 42 51 53 55,34070500650,0,3299844550,0
582,341,#00341,08/10/2019,2019-10-08 00:00:00.000000,08,36,39,43,48,50,40,08 36 39 43 48 50,32751516900,0,3153290800,0
583,340,#00340,05/10/2019,2019-10-05 00:00:00.000000,10,29,30,31,37,51,50,10 29 30 31 37 51,31371899700,0,3359683250,1
584,339,#00339,03/10/2019,2019-10-03 00:00:00.000000,04,07,08,26,37,44,29,04 07 08 26 37 44,80834053800,1,3207249950,0
585,338,#00338,01/10/2019,2019-10-01 00:00:00.000000,05,22,38,41,47,49,29,05 22 38 41 47 49,78968804250,0,4610358600,1
586,337,#00337,28/09/2019,2019-09-28 00:00:00.000000,04,08,21,23,40,43,44,04 08 21 23 40 43,76640721150,0,4351682700,0
587,336,#00336,26/09/2019,2019-09-26 00:00:00.000000,07,12,38,43,51,55,15,07 12 38 43 51 55,74541701100,0,4118458250,0
588,335,#00335,24/09/2019,2019-09-24 00:00:00.000000,12,33,39,40,48,53,35,12 33 39 40 48 53,72724240650,0,3916518200,0
589,334,#00334,21/09/2019,2019-09-21 00:00:00.000000,02,05,23,30,42,45,34,02 05 23 30 42 45,70806645750,0,3703452100,0
590,333,#00333,19/09/2019,2019-09-19 00:00:00.000000,02,08,22,34,39,41,13,02 08 22 34 39 41,69277580400,0,3533555950,0
591,332,#00332,17/09/2019,2019-09-17 00:00:00.000000,03,14,26,38,43,47,10,03 14 26 38 43 47,67885940550,0,3378929300,0
592,331,#00331,14/09/2019,2019-09-14 00:00:00.000000,10,36,42,44,45,54,14,10 36 42 44 45 54,66202794750,0,3191913100,0
593,330,#00330,12/09/2019,2019-09-12 00:00:00.000000,18,29,32,33,45,49,40,18 29 32 33 45 49,64475576850,0,3179297550,1
594,329,#00329,10/09/2019,2019-09-10 00:00:00.000000,06,09,19,39,50,54,37,06 09 19 39 50 54,62861898900,0,4443960950,1
595,328,#00328,07/09/2019,2019-09-07 00:00:00.000000,07,17,31,35,38,46,16,07 17 31 35 38 46,61549528800,0,4298142050,0
596,327,#00327,05/09/2019,2019-09-05 00:00:00.000000,20,24,27,30,33,45,21,20 24 27 30 33 45,60028396500,0,4129127350,0
597,326,#00326,03/09/2019,2019-09-03 00:00:00.000000,13,14,29,35,41,55,25,13 14 29 35 41 55,58394904150,0,3947628200,0
598,325,#00325,31/08/2019,2019-08-31 00:00:00.000000,13,20,23,32,51,52,42,13 20 23 32 51 52,56692930350,0,3758520000,0
599,324,#00324,29/08/2019,2019-08-29 00:00:00.000000,10,11,12,23,27,48,09,10 11 12 23 27 48,54916559850,0,3561145500,0
600,323,#00323,27/08/2019,2019-08-27 00:00:00.000000,16,22,29,33,46,47,55,16 22 29 33 46 47,53375693250,0,3389938100,0
601,322,#00322,24/08/2019,2019-08-24 00:00:00.000000,19,20,34,40,49,51,01,19 20 34 40 49 51,51577194000,0,3190104850,0
602,321,#00321,22/08/2019,2019-08-22 00:00:00.000000,04,07,16,17,30,39,27,04 07 16 17 30 39,49866250350,0,4174804800,1
603,320,#00320,20/08/2019,2019-08-20 00:00:00.000000,10,30,38,48,54,55,46,10 30 38 48 54 55,48546543000,0,4028170650,0
604,319,#00319,17/08/2019,2019-08-17 00:00:00.000000,09,11,24,26,38,53,41,09 11 24 26 38 53,46901064450,0,3845339700,0
605,318,#00318,15/08/2019,2019-08-15 00:00:00.000000,19,25,31,32,39,47,08,19 25 31 32 39 47,45290687700,0,3666408950,0
606,317,#00317,13/08/2019,2019-08-13 00:00:00.000000,04,08,16,27,32,40,23,04 08 16 27 32 40,43839772950,0,3505196200,0
607,316,#00316,10/08/2019,2019-08-10 00:00:00.000000,07,17,36,42,43,50,44,07 17 36 42 43 50,42504716100,0,3356856550,0
608,315,#00315,08/08/2019,2019-08-08 00:00:00.000000,01,06,17,18,21,41,22,01 06 17 18 21 41,40878482250,0,3176163900,0
609,314,#00314,06/08/2019,2019-08-06 00:00:00.000000,09,11,19,20,26,42,17,09 11 19 20 26 42,39293007150,0,4032556350,1
610,313,#00313,03/08/2019,2019-08-03 00:00:00.000000,13,24,25,26,27,30,04,13 24 25 26 27 30,38078447700,0,3897605300,0
611,312,#00312,01/08/2019,2019-08-01 00:00:00.000000,01,18,39,45,48,49,26,01 18 39 45 48 49,36751522800,0,3750169200,0
612,311,#00311,30/07/2019,2019-07-30 00:00:00.000000,03,08,12,21,32,51,07,03 08 12 21 32 51,35273732250,0,3585970250,0
613,310,#00310,27/07/2019,2019-07-27 00:00:00.000000,02,03,25,33,44,50,17,02 03 25 33 44 50,33976192350,0,3441799150,0
614,309,#00309,25/07/2019,2019-07-25 00:00:00.000000,03,31,34,41,52,53,16,03 31 34 41 52 53,32670348600,0,3296705400,0
615,308,#00308,23/07/2019,2019-07-23 00:00:00.000000,05,10,21,32,39,52,41,05 10 21 32 39 52,31304538750,0,3144948750,0
616,307,#00307,20/07/2019,2019-07-20 00:00:00.000000,15,18,25,32,42,52,10,15 18 25 32 42 52,99612417000,1,8037765200,2
617,306,#00306,18/07/2019,2019-07-18 00:00:00.000000,04,24,29,31,39,41,38,04 24 29 31 39 41,97303702800,0,3762358800,0
618,305,#00305,16/07/2019,2019-07-16 00:00:00.000000,04,12,19,31,33,40,51,04 12 19 31 33 40,94600472250,0,3461999850,0
619,304,#00304,13/07/2019,2019-07-13 00:00:00.000000,05,23,29,45,50,52,01,05 23 29 45 50 52,92278133400,0,3203962200,0
620,303,#00303,11/07/2019,2019-07-11 00:00:00.000000,06,09,15,26,35,38,34,06 09 15 26 35 38,90442473600,0,4368840150,1
621,302,#00302,09/07/2019,2019-07-09 00:00:00.000000,04,17,25,40,42,51,02,04 17 25 40 42 51,88891229550,0,4196479700,0
622,301,#00301,06/07/2019,2019-07-06 00:00:00.000000,05,29,36,39,46,53,48,05 29 36 39 46 53,86460678750,0,3926418500,0
623,300,#00300,04/07/2019,2019-07-04 00:00:00.000000,04,05,14,46,52,54,03,04 05 14 46 52 54,84311080050,0,3687574200,0
624,299,#00299,02/07/2019,2019-07-02 00:00:00.000000,02,09,33,45,52,54,01,02 09 33 45 52 54,82181480700,0,3450952050,0
625,298,#00298,29/06/2019,2019-06-29 00:00:00.000000,06,10,19,31,34,43,37,06 10 19 31 34 43,79909429350,0,3198501900,0
626,297,#00297,27/06/2019,2019-06-27 00:00:00.000000,09,29,32,44,49,53,05,09 29 32 44 49 53,78122912250,0,4530368650,1
627,296,#00296,25/06/2019,2019-06-25 00:00:00.000000,03,14,34,35,40,49,23,03 14 34 35 40 49,76160770950,0,4312352950,0
628,295,#00295,22/06/2019,2019-06-22 00:00:00.000000,01,09,23,28,42,54,49,01 09 23 28 42 54,73896412800,0,4060757600,0
629,294,#00294,20/06/2019,2019-06-20 00:00:00.000000,09,15,23,41,49,51,52,09 15 23 41 49 51,71915836350,0,3840693550,0
630,293,#00293,18/06/2019,2019-06-18 00:00:00.000000,24,31,45,46,47,54,04,24 31 45 46 47 54,70095625050,0,3638447850,0
631,292,#00292,15/06/2019,2019-06-15 00:00:00.000000,13,23,40,45,52,55,09,13 23 40 45 52 55,67915717950,0,3396235950,0
632,291,#00291,13/06/2019,2019-06-13 00:00:00.000000,06,09,15,22,29,53,25,06 09 15 22 29 53,65946387450,0,3177421450,0
633,290,#00290,11/06/2019,2019-06-11 00:00:00.000000,02,05,13,20,30,49,35,02 05 13 20 30 49,64349594400,0,4397402900,1
634,289,#00289,08/06/2019,2019-06-08 00:00:00.000000,02,08,10,23,27,35,47,02 08 10 23 27 35,62484145050,0,4190130750,0
635,288,#00288,06/06/2019,2019-06-06 00:00:00.000000,10,13,30,36,51,54,16,10 13 30 36 51 54,60811500000,0,4004281300,0
636,287,#00287,04/06/2019,2019-06-04 00:00:00.000000,18,20,24,26,33,41,55,18 20 24 26 33 41,59020828950,0,3805317850,0
637,286,#00286,01/06/2019,2019-06-01 00:00:00.000000,10,24,31,41,42,47,20,10 24 31 41 42 47,56962077600,0,3576567700,0
638,285,#00285,30/05/2019,2019-05-30 00:00:00.000000,17,31,33,34,37,40,35,17 31 33 34 37 40,55166476800,0,3377056500,0
639,284,#00284,28/05/2019,2019-05-28 00:00:00.000000,15,22,31,32,33,37,51,15 22 31 32 33 37,53501940750,0,3192108050,0
640,283,#00283,25/05/2019,2019-05-25 00:00:00.000000,04,12,35,44,50,55,19,04 12 35 44 50 55,51772968300,0,4511876700,1
641,282,#00282,23/05/2019,2019-05-23 00:00:00.000000,13,21,33,42,53,55,44,13 21 33 42 53 55,50248806150,0,4342525350,0
642,281,#00281,21/05/2019,2019-05-21 00:00:00.000000,11,12,29,31,37,53,41,11 12 29 31 37 53,48503567100,0,4148609900,0
643,280,#00280,18/05/2019,2019-05-18 00:00:00.000000,06,10,13,18,29,38,53,06 10 13 18 29 38,46636259700,0,3941131300,0
644,279,#00279,16/05/2019,2019-05-16 00:00:00.000000,08,28,30,33,40,43,24,08 28 30 33 40 43,45292760400,0,3791853600,0
645,278,#00278,14/05/2019,2019-05-14 00:00:00.000000,06,11,15,21,30,40,10,06 11 15 21 30 40,43647956850,0,3609097650,0
646,277,#00277,11/05/2019,2019-05-11 00:00:00.000000,06,11,20,22,26,28,36,06 11 20 22 26 28,42030094350,0,3429335150,0
647,276,#00276,09/05/2019,2019-05-09 00:00:00.000000,19,21,48,49,54,55,27,19 21 48 49 54 55,40648074600,0,3275777400,0
648,275,#00275,07/05/2019,2019-05-07 00:00:00.000000,03,06,07,08,09,49,24,03 06 07 08 09 49,39120897000,0,3106091000,0
649,274,#00274,04/05/2019,2019-05-04 00:00:00.000000,01,02,03,17,26,53,50,01 02 03 17 26 53,38166078000,0,3907342000,1
650,273,#00273,02/05/2019,2019-05-02 00:00:00.000000,02,10,16,17,33,36,20,02 10 16 17 33 36,36699868650,0,3744429850,0
651,272,#00272,30/04/2019,2019-04-30 00:00:00.000000,03,05,13,40,41,45,52,03 05 13 40 41 45,35412222450,0,3601358050,0
652,271,#00271,27/04/2019,2019-04-27 00:00:00.000000,01,11,22,26,33,51,04,01 11 22 26 33 51,34252173750,0,3472463750,0
653,270,#00270,25/04/2019,2019-04-25 00:00:00.000000,16,22,23,33,36,38,45,16 22 23 33 36 38,32860128000,0,3317792000,0
654,269,#00269,23/04/2019,2019-04-23 00:00:00.000000,20,21,22,31,43,45,30,20 21 22 31 43 45,31616504400,0,3179611600,0
655,268,#00268,20/04/2019,2019-04-20 00:00:00.000000,08,10,12,24,40,44,51,08 10 12 24 40 44,119957842650,1,4699731700,1
656,267,#00267,18/04/2019,2019-04-18 00:00:00.000000,07,08,15,24,26,48,10,07 08 15 24 26 48,117272637300,0,4401375550,0
657,266,#00266,16/04/2019,2019-04-16 00:00:00.000000,16,29,32,33,52,53,05,16 29 32 33 52 53,114222823500,0,4062507350,0
658,265,#00265,13/04/2019,2019-04-13 00:00:00.000000,09,13,20,21,36,43,32,09 13 20 21 36 43,110883292950,0,3691448400,0
659,264,#00264,11/04/2019,2019-04-11 00:00:00.000000,01,08,31,32,37,55,53,01 08 31 32 37 55,107805747000,0,3349498850,0
660,263,#00263,09/04/2019,2019-04-09 00:00:00.000000,10,14,19,36,48,49,03,10 14 19 36 48 49,104660257350,0,3705261050,1
661,262,#00262,06/04/2019,2019-04-06 00:00:00.000000,01,20,30,41,46,50,48,01 20 30 41 46 50,101454269700,0,3349040200,0
662,261,#00261,04/04/2019,2019-04-04 00:00:00.000000,16,26,29,38,47,51,13,16 26 29 38 47 51,98312907900,0,3597381000,1
663,260,#00260,02/04/2019,2019-04-02 00:00:00.000000,01,04,09,20,22,26,48,01 04 09 20 22 26,95702711250,0,3307359150,0
664,259,#00259,30/03/2019,2019-03-30 00:00:00.000000,03,15,18,35,50,54,32,03 15 18 35 50 54,92936478900,0,3564575350,1
665,258,#00258,28/03/2019,2019-03-28 00:00:00.000000,03,23,37,43,44,49,27,03 23 37 43 44 49,90282744300,0,3269715950,0
666,257,#00257,26/03/2019,2019-03-26 00:00:00.000000,15,19,28,40,44,48,14,15 19 28 40 44 48,87855300750,0,4377501800,1
667,256,#00256,23/03/2019,2019-03-23 00:00:00.000000,03,09,30,41,46,52,22,03 09 30 41 46 52,85400833350,0,4104783200,0
668,255,#00255,21/03/2019,2019-03-21 00:00:00.000000,07,18,32,42,46,53,28,07 18 32 42 46 53,82774946550,0,3813018000,0
669,254,#00254,19/03/2019,2019-03-19 00:00:00.000000,08,28,32,35,40,45,34,08 28 32 35 40 45,80316793200,0,3539889850,0
670,253,#00253,16/03/2019,2019-03-16 00:00:00.000000,10,18,22,24,35,40,53,10 18 22 24 35 40,77924209350,0,3274047200,0
671,252,#00252,14/03/2019,2019-03-14 00:00:00.000000,18,21,25,35,44,53,04,18 21 25 35 44 53,75457784550,0,3267720100,1
672,251,#00251,12/03/2019,2019-03-12 00:00:00.000000,09,16,26,34,44,49,19,09 16 26 34 44 49,73048303650,0,3293307650,1
673,250,#00250,09/03/2019,2019-03-09 00:00:00.000000,18,24,31,34,35,44,52,18 24 31 34 35 44,70408534800,0,3917427600,1
674,249,#00249,07/03/2019,2019-03-07 00:00:00.000000,02,14,20,33,41,47,27,02 14 20 33 41 47,68424485250,0,3696977650,0
675,248,#00248,05/03/2019,2019-03-05 00:00:00.000000,01,15,23,51,53,55,26,01 15 23 51 53 55,66291315150,0,3459958750,0
676,247,#00247,02/03/2019,2019-03-02 00:00:00.000000,01,02,03,20,46,48,31,01 02 03 20 46 48,64196433750,0,3227194150,0
677,246,#00246,28/02/2019,2019-02-28 00:00:00.000000,04,15,19,34,40,42,49,04 15 19 34 40 42,62151686400,0,3659927700,1
678,245,#00245,26/02/2019,2019-02-26 00:00:00.000000,08,09,16,34,42,43,45,08 09 16 34 42 43,60260695050,0,3449817550,0
679,244,#00244,23/02/2019,2019-02-23 00:00:00.000000,16,19,30,39,43,52,21,16 19 30 39 43 52,58168007850,0,3217296750,0
680,243,#00243,21/02/2019,2019-02-21 00:00:00.000000,03,10,11,15,29,34,50,03 10 11 15 29 34,56212337100,0,6360507100,1
681,242,#00242,19/02/2019,2019-02-19 00:00:00.000000,12,18,22,29,32,52,51,12 18 22 29 32 52,54466250250,0,6166497450,0
682,241,#00241,16/02/2019,2019-02-16 00:00:00.000000,05,08,14,28,37,40,41,05 08 14 28 37 40,52474074150,0,5945144550,0
683,240,#00240,14/02/2019,2019-02-14 00:00:00.000000,08,15,26,41,43,53,46,08 15 26 41 43 53,50622710700,0,5739437500,0
684,239,#00239,12/02/2019,2019-02-12 00:00:00.000000,01,12,17,34,48,49,47,01 12 17 34 48 49,48334463400,0,5485187800,0
685,238,#00238,09/02/2019,2019-02-09 00:00:00.000000,02,14,15,44,46,50,18,02 14 15 44 46 50,46036778250,0,5229889450,0
686,237,#00237,07/02/2019,2019-02-07 00:00:00.000000,20,27,28,32,47,50,41,20 27 28 32 47 50,44397880500,0,5047789700,0
687,236,#00236,02/02/2019,2019-02-02 00:00:00.000000,11,23,27,35,36,46,37,11 23 27 35 36 46,42935678850,0,4885322850,0
688,235,#00235,31/01/2019,2019-01-31 00:00:00.000000,10,19,20,28,34,44,29,10 19 20 28 34 44,41293427700,0,4702850500,0
689,234,#00234,29/01/2019,2019-01-29 00:00:00.000000,15,20,26,41,45,55,10,15 20 26 41 45 55,39668776950,0,4522333750,0
690,233,#00233,26/01/2019,2019-01-26 00:00:00.000000,20,27,33,43,53,54,48,20 27 33 43 53 54,37689645000,0,4302430200,0
691,232,#00232,24/01/2019,2019-01-24 00:00:00.000000,31,35,38,44,49,55,24,31 35 38 44 49 55,36240081150,0,4141367550,0
692,231,#00231,22/01/2019,2019-01-22 00:00:00.000000,01,14,22,40,52,55,21,01 14 22 40 52 55,34615289550,0,3960835150,0
693,230,#00230,19/01/2019,2019-01-19 00:00:00.000000,13,29,42,46,51,53,36,13 29 42 46 51 53,32903474700,0,3770633500,0
694,229,#00229,17/01/2019,2019-01-17 00:00:00.000000,13,14,22,34,35,55,54,13 14 22 34 35 55,31343414700,0,3597293500,0
695,228,#00228,15/01/2019,2019-01-15 00:00:00.000000,04,06,13,22,29,30,52,04 06 13 22 29 30,77234333700,1,3448025200,0
696,227,#00227,12/01/2019,2019-01-12 00:00:00.000000,07,13,14,26,42,54,11,07 13 14 26 42 54,74780896800,0,3175421100,0
697,226,#00226,10/01/2019,2019-01-10 00:00:00.000000,12,22,31,35,40,47,08,12 22 31 35 40 47,73202106900,0,3519027500,1
698,225,#00225,08/01/2019,2019-01-08 00:00:00.000000,03,05,09,11,45,48,40,03 05 09 11 45 48,70875624450,0,3260529450,0
699,224,#00224,05/01/2019,2019-01-05 00:00:00.000000,10,11,38,47,53,55,51,10 11 38 47 53 55,68530859400,0,3451848750,1
700,223,#00223,03/01/2019,2019-01-03 00:00:00.000000,23,31,37,45,49,54,18,23 31 37 45 49 54,66387325800,0,3213678350,0
701,222,#00222,01/01/2019,2019-01-01 00:00:00.000000,02,19,21,27,37,46,12,02 19 21 27 37 46,64464220650,0,3655801500,1
702,221,#00221,29/12/2018,2018-12-29 00:00:00.000000,08,36,42,43,50,52,30,08 36 42 43 50 52,62343118200,0,3420123450,0
703,220,#00220,27/12/2018,2018-12-27 00:00:00.000000,05,20,33,42,43,50,40,05 20 33 42 43 50,60350101500,0,3198677150,0
704,219,#00219,25/12/2018,2018-12-25 00:00:00.000000,03,09,17,21,23,51,15,03 09 17 21 23 51,58562007150,0,3763148550,1
705,218,#00218,22/12/2018,2018-12-22 00:00:00.000000,03,08,16,35,39,52,29,03 08 16 35 39 52,56763061950,0,3563265750,0
706,217,#00217,20/12/2018,2018-12-20 00:00:00.000000,08,17,24,33,34,44,55,08 17 24 33 34 44,55116976800,0,3380367400,0
707,216,#00216,18/12/2018,2018-12-18 00:00:00.000000,01,09,15,17,25,26,08,01 09 15 17 25 26,53457332700,0,3195962500,0
708,215,#00215,15/12/2018,2018-12-15 00:00:00.000000,14,17,49,52,53,55,12,14 17 49 52 53 55,51693670200,0,4500296150,1
709,214,#00214,13/12/2018,2018-12-13 00:00:00.000000,02,11,14,36,49,55,53,02 11 14 36 49 55,49539451350,0,4260938500,0
710,213,#00213,11/12/2018,2018-12-11 00:00:00.000000,01,05,11,37,39,44,31,01 05 11 37 39 44,47620664400,0,4047739950,0
711,212,#00212,08/12/2018,2018-12-08 00:00:00.000000,03,06,09,31,48,54,53,03 06 09 31 48 54,45711703650,0,3835633200,0
712,211,#00211,06/12/2018,2018-12-06 00:00:00.000000,09,13,23,27,39,42,49,09 13 23 27 39 42,43892386050,0,3633486800,0
713,210,#00210,04/12/2018,2018-12-04 00:00:00.000000,10,13,16,23,30,49,24,10 13 16 23 30 49,42768578550,0,3508619300,0
714,209,#00209,01/12/2018,2018-12-01 00:00:00.000000,03,05,12,20,25,33,41,03 05 12 20 25 33,40936775250,0,3305085600,0
715,208,#00208,29/11/2018,2018-11-29 00:00:00.000000,10,23,27,42,51,52,20,10 23 27 42 51 52,39994410450,0,3200378400,0
716,207,#00207,27/11/2018,2018-11-27 00:00:00.000000,03,05,23,28,35,44,08,03 05 23 28 35 44,38191004850,0,3290607600,1
717,206,#00206,24/11/2018,2018-11-24 00:00:00.000000,03,10,11,25,40,54,17,03 10 11 25 40 54,36820442100,0,3138322850,0
718,205,#00205,22/11/2018,2018-11-22 00:00:00.000000,17,22,24,28,37,44,06,17 22 24 28 37 44,35575536450,0,3984511300,1
719,204,#00204,20/11/2018,2018-11-20 00:00:00.000000,09,23,33,40,44,49,17,09 23 33 40 44 49,34256649000,0,3837968250,0
720,203,#00203,17/11/2018,2018-11-17 00:00:00.000000,12,22,26,29,45,47,15,12 22 26 29 45 47,32831024250,0,3679565500,0
721,202,#00202,15/11/2018,2018-11-15 00:00:00.000000,13,16,21,40,49,52,54,13 16 21 40 49 52,31465133850,0,3527799900,0
722,201,#00201,13/11/2018,2018-11-13 00:00:00.000000,03,25,26,32,41,47,05,03 25 26 32 41 47,41305528200,1,3365007250,0
723,200,#00200,10/11/2018,2018-11-10 00:00:00.000000,03,05,19,22,29,39,15,03 05 19 22 29 39,39307347750,0,3142987200,0
724,199,#00199,08/11/2018,2018-11-08 00:00:00.000000,22,28,31,39,52,53,14,22 28 31 39 52 53,38020462950,0,5236233250,1
725,198,#00198,06/11/2018,2018-11-06 00:00:00.000000,19,22,23,43,47,53,03,19 22 23 43 47 53,36334813350,0,5048938850,0
726,197,#00197,03/11/2018,2018-11-03 00:00:00.000000,14,17,20,23,25,45,34,14 17 20 23 25 45,34340501100,0,4827348600,0
727,196,#00196,01/11/2018,2018-11-01 00:00:00.000000,03,11,15,42,44,54,41,03 11 15 42 44 54,32839102200,0,4660526500,0
728,195,#00195,30/10/2018,2018-10-30 00:00:00.000000,01,12,22,27,30,39,46,01 12 22 27 30 39,31358509500,0,4496016200,0
729,194,#00194,27/10/2018,2018-10-27 00:00:00.000000,08,09,15,21,44,49,16,08 09 15 21 44 49,96756562650,1,4345070700,0
730,193,#00193,25/10/2018,2018-10-25 00:00:00.000000,16,23,29,31,45,48,19,16 23 29 31 45 48,94362451050,0,4079058300,0
731,192,#00192,23/10/2018,2018-10-23 00:00:00.000000,01,03,06,13,21,30,36,01 03 06 13 21 30,91712411850,0,3784609500,0
732,191,#00191,20/10/2018,2018-10-20 00:00:00.000000,02,05,10,17,35,41,21,02 05 10 17 35 41,89122986750,0,3496895600,0
733,190,#00190,18/10/2018,2018-10-18 00:00:00.000000,01,11,22,34,42,47,30,01 11 22 34 42 47,86856031200,0,3245011650,0
734,189,#00189,16/10/2018,2018-10-16 00:00:00.000000,05,28,29,34,42,46,17,05 28 29 34 42 46,84650926350,0,9867003000,2
735,188,#00188,13/10/2018,2018-10-13 00:00:00.000000,12,21,23,44,47,48,43,12 21 23 44 47 48,82070152050,0,4646748800,0
736,187,#00187,11/10/2018,2018-10-11 00:00:00.000000,05,16,17,37,46,49,35,05 16 17 37 46 49,79704990300,0,4383953050,0
737,186,#00186,09/10/2018,2018-10-09 00:00:00.000000,10,27,46,50,51,55,01,10 27 46 50 51 55,77724187950,0,4163863900,0
738,185,#00185,06/10/2018,2018-10-06 00:00:00.000000,05,06,16,42,48,51,03,05 06 16 42 48 51,75218555100,0,3885460250,0
739,184,#00184,04/10/2018,2018-10-04 00:00:00.000000,03,09,12,17,34,42,46,03 09 12 17 34 42,72901033500,0,3627957850,0
740,183,#00183,02/10/2018,2018-10-02 00:00:00.000000,03,07,28,32,33,37,22,03 07 28 32 33 37,71233011300,0,3442622050,0
741,182,#00182,29/09/2018,2018-09-29 00:00:00.000000,03,07,12,32,34,55,38,03 07 12 32 34 55,69155020650,0,3211734200,0
742,181,#00181,27/09/2018,2018-09-27 00:00:00.000000,08,12,29,35,51,54,34,08 12 29 35 51 54,67249412850,0,3213103350,1
743,180,#00180,25/09/2018,2018-09-25 00:00:00.000000,02,03,06,13,14,17,09,02 03 06 13 14 17,65331482700,0,3884290450,1
744,179,#00179,22/09/2018,2018-09-22 00:00:00.000000,01,08,17,28,40,50,21,01 08 17 28 40 50,63494160150,0,3680143500,0
745,178,#00178,20/09/2018,2018-09-20 00:00:00.000000,03,32,35,46,47,49,51,03 32 35 46 47 49,61507022700,0,3459350450,0
746,177,#00177,18/09/2018,2018-09-18 00:00:00.000000,08,21,32,43,48,53,38,08 21 32 43 48 53,59535024150,0,3240239500,0
747,176,#00176,15/09/2018,2018-09-15 00:00:00.000000,02,05,28,30,46,50,49,02 05 28 30 46 50,57372868650,0,5333582600,1
748,175,#00175,13/09/2018,2018-09-13 00:00:00.000000,04,06,07,26,40,44,09,04 06 07 26 40 44,55368863400,0,5110915350,0
749,174,#00174,11/09/2018,2018-09-11 00:00:00.000000,13,17,28,42,45,49,50,13 17 28 42 45 49,53696842500,0,4925135250,0
750,173,#00173,08/09/2018,2018-09-08 00:00:00.000000,09,11,12,24,35,43,15,09 11 12 24 35 43,51566176200,0,4688394550,0
751,172,#00172,06/09/2018,2018-09-06 00:00:00.000000,04,11,15,21,24,27,07,04 11 15 21 24 27,49962814050,0,4510243200,0
752,171,#00171,04/09/2018,2018-09-04 00:00:00.000000,08,18,20,29,34,37,51,08 18 20 29 34 37,48210550500,0,4315547250,0
753,170,#00170,01/09/2018,2018-09-01 00:00:00.000000,02,08,20,21,28,36,05,02 08 20 21 28 36,46296717600,0,4102899150,0
754,169,#00169,30/08/2018,2018-08-30 00:00:00.000000,05,22,28,42,49,54,36,05 22 28 42 49 54,44848312950,0,3941965300,0
755,168,#00168,28/08/2018,2018-08-28 00:00:00.000000,02,10,15,31,39,48,23,02 10 15 31 39 48,43233200400,0,3762508350,0
756,167,#00167,25/08/2018,2018-08-25 00:00:00.000000,10,11,15,32,40,48,27,10 11 15 32 40 48,41260462050,0,3543315200,0
757,166,#00166,23/08/2018,2018-08-23 00:00:00.000000,14,18,27,38,39,53,02,14 18 27 38 39 53,39404614350,0,3337109900,0
758,165,#00165,21/08/2018,2018-08-21 00:00:00.000000,09,12,14,23,32,46,31,09 12 14 23 32 46,38068041000,0,3188601750,0
759,164,#00164,18/08/2018,2018-08-18 00:00:00.000000,07,33,36,39,51,55,11,07 33 36 39 51 55,36370625250,0,3156157700,1
760,163,#00163,16/08/2018,2018-08-16 00:00:00.000000,06,10,34,46,48,51,47,06 10 34 46 48 51,34965205950,0,3140259400,1
761,162,#00162,14/08/2018,2018-08-14 00:00:00.000000,29,30,36,38,45,52,46,29 30 36 38 45 52,33702871350,0,3596064250,1
762,161,#00161,11/08/2018,2018-08-11 00:00:00.000000,16,17,31,33,42,44,14,16 17 31 33 42 44,32194626150,0,3428481450,0
763,160,#00160,09/08/2018,2018-08-09 00:00:00.000000,24,29,32,33,49,55,09,24 29 32 33 49 55,31059648300,0,3302372800,0
764,159,#00159,07/08/2018,2018-08-07 00:00:00.000000,03,09,15,20,39,49,04,03 09 15 20 39 49,47175342150,1,3184634100,0
765,158,#00158,04/08/2018,2018-08-04 00:00:00.000000,11,12,24,32,41,48,03,11 12 24 32 41 48,45513635250,0,3631662050,1
766,157,#00157,02/08/2018,2018-08-02 00:00:00.000000,06,11,16,17,41,55,07,06 11 16 17 41 55,43671479700,0,3426978100,0
767,156,#00156,31/07/2018,2018-07-31 00:00:00.000000,01,05,27,31,47,50,41,01 05 27 31 47 50,41892910050,0,3229359250,0
768,155,#00155,28/07/2018,2018-07-28 00:00:00.000000,11,16,22,25,30,40,09,11 16 22 25 30 40,39828676800,0,4683462000,1
769,154,#00154,26/07/2018,2018-07-26 00:00:00.000000,21,24,33,37,40,46,52,21 24 33 37 40 46,38113527900,0,4492889900,0
770,153,#00153,24/07/2018,2018-07-24 00:00:00.000000,11,18,34,37,50,53,20,11 18 34 37 50 53,36779450250,0,4344659050,0
771,152,#00152,21/07/2018,2018-07-21 00:00:00.000000,07,31,33,37,46,52,28,07 31 33 37 46 52,34751723250,0,4119356050,0
772,151,#00151,19/07/2018,2018-07-19 00:00:00.000000,11,13,28,34,44,47,10,11 13 28 34 44 47,33072762000,0,3932804800,0
773,150,#00150,17/07/2018,2018-07-17 00:00:00.000000,05,14,22,27,31,40,48,05 14 22 27 31 40,31660230900,0,3775856900,0
774,149,#00149,14/07/2018,2018-07-14 00:00:00.000000,04,19,23,34,38,50,01,04 19 23 34 38 50,47012873700,1,3591386800,0
775,148,#00148,12/07/2018,2018-07-12 00:00:00.000000,08,15,18,21,24,49,22,08 15 18 21 24 49,45034013550,0,3371513450,0
776,147,#00147,10/07/2018,2018-07-10 00:00:00.000000,06,10,16,20,27,29,24,06 10 16 20 27 29,43270472550,0,3175564450,0
777,146,#00146,07/07/2018,2018-07-07 00:00:00.000000,02,30,45,48,49,53,41,02 30 45 48 49 53,41690392500,0,3939988950,1
778,145,#00145,05/07/2018,2018-07-05 00:00:00.000000,04,15,22,24,43,51,48,04 15 22 24 43 51,39908934300,0,3742049150,0
779,144,#00144,03/07/2018,2018-07-03 00:00:00.000000,30,32,34,47,48,49,50,30 32 34 47 48 49,38162758350,0,3548029600,0
780,143,#00143,30/06/2018,2018-06-30 00:00:00.000000,03,12,23,24,30,33,01,03 12 23 24 30 33,36351516000,0,3346780450,0
781,142,#00142,28/06/2018,2018-06-28 00:00:00.000000,11,31,33,43,48,51,23,11 31 33 43 48 51,34769813250,0,3171035700,0
782,141,#00141,26/06/2018,2018-06-26 00:00:00.000000,17,18,21,39,40,43,03,17 18 21 39 40 43,33230491950,0,7937664000,2
783,140,#00140,23/06/2018,2018-06-23 00:00:00.000000,06,08,13,23,46,55,01,06 08 13 23 46 55,31562051700,0,3783449750,0
784,139,#00139,21/06/2018,2018-06-21 00:00:00.000000,02,08,19,23,25,33,32,02 08 19 23 25 33,44151049200,1,3609888450,0
785,138,#00138,19/06/2018,2018-06-19 00:00:00.000000,16,17,31,37,41,52,34,16 17 31 37 41 52,42685218300,0,3447018350,0
786,137,#00137,16/06/2018,2018-06-16 00:00:00.000000,14,15,21,30,44,47,48,14 15 21 30 44 47,40558167300,0,3210679350,0
787,136,#00136,14/06/2018,2018-06-14 00:00:00.000000,03,15,32,45,48,54,55,03 15 32 45 48 54,38662053150,0,4150397100,1
788,135,#00135,12/06/2018,2018-06-12 00:00:00.000000,04,13,23,27,29,35,14,04 13 23 27 29 35,36793704900,0,3942802850,0
789,134,#00134,09/06/2018,2018-06-09 00:00:00.000000,09,23,25,39,52,53,38,09 23 25 39 52 53,35057037900,0,3749839850,0
790,133,#00133,07/06/2018,2018-06-07 00:00:00.000000,11,16,18,26,46,47,42,11 16 18 26 46 47,33451356000,0,3571430750,0
791,132,#00132,05/06/2018,2018-06-05 00:00:00.000000,11,21,26,32,51,52,05,11 21 26 32 51 52,31656701100,0,3372024650,0
792,131,#00131,02/06/2018,2018-06-02 00:00:00.000000,05,07,17,22,32,33,06,05 07 17 22 32 33,40421556750,1,3187946750,0
793,130,#00130,31/05/2018,2018-05-31 00:00:00.000000,03,15,18,25,26,29,19,03 15 18 25 26 29,38730036000,0,3772192400,1
794,129,#00129,29/05/2018,2018-05-29 00:00:00.000000,09,13,17,18,46,50,26,09 13 17 18 46 50,37041107700,0,3584533700,0
795,128,#00128,26/05/2018,2018-05-26 00:00:00.000000,07,12,28,31,40,44,15,07 12 28 31 40 44,35144050350,0,3373749550,0
796,127,#00127,24/05/2018,2018-05-24 00:00:00.000000,24,25,26,29,36,48,40,24 25 26 29 36 48,33284469900,0,3167129500,0
797,126,#00126,22/05/2018,2018-05-22 00:00:00.000000,04,05,08,17,35,47,39,04 05 08 17 35 47,31780304400,0,3647009800,1
798,125,#00125,19/05/2018,2018-05-19 00:00:00.000000,33,35,45,52,53,55,25,33 35 45 52 53 55,42114151200,1,3449198200,0
799,124,#00124,17/05/2018,2018-05-17 00:00:00.000000,13,31,38,45,53,55,46,13 31 38 45 53 55,40161824400,0,3232273000,0
800,123,#00123,15/05/2018,2018-05-15 00:00:00.000000,03,06,29,37,44,49,24,03 06 29 37 44 49,38071367400,0,4330115250,1
801,122,#00122,12/05/2018,2018-05-12 00:00:00.000000,01,09,26,38,54,55,51,01 09 26 38 54 55,35643065250,0,4060303900,0
802,121,#00121,10/05/2018,2018-05-10 00:00:00.000000,02,06,08,34,39,43,11,02 06 08 34 39 43,33632951700,0,3836957950,0
803,120,#00120,08/05/2018,2018-05-08 00:00:00.000000,03,16,23,24,38,42,48,03 16 23 24 38 42,31688034150,0,3620856000,0
804,119,#00119,05/05/2018,2018-05-05 00:00:00.000000,16,32,33,37,40,48,15,16 32 33 37 40 48,303899669850,1,3433296650,0
805,118,#00118,03/05/2018,2018-05-03 00:00:00.000000,23,27,33,37,39,49,44,23 27 33 37 39 49,300000000000,0,36846222000,1
806,117,#00117,01/05/2018,2018-05-01 00:00:00.000000,01,07,20,23,25,38,14,01 07 20 23 25 38,323711172750,0,5634574750,0
807,116,#00116,28/04/2018,2018-04-28 00:00:00.000000,12,19,22,29,32,46,25,12 19 22 29 32 46,317750310300,0,4972256700,0
808,115,#00115,26/04/2018,2018-04-26 00:00:00.000000,23,26,29,31,36,54,55,23 26 29 31 36 54,311383703550,0,4264855950,0
809,114,#00114,24/04/2018,2018-04-24 00:00:00.000000,17,18,24,40,41,46,06,17 18 24 40 41 46,305150984400,0,3572331600,0
810,113,#00113,21/04/2018,2018-04-21 00:00:00.000000,16,18,41,43,46,55,35,16 18 41 43 46 55,300000000000,0,7716697000,1
811,112,#00112,19/04/2018,2018-04-19 00:00:00.000000,04,17,19,35,49,55,09,04 17 19 35 49 55,300000000000,0,7032403500,1
812,111,#00111,17/04/2018,2018-04-17 00:00:00.000000,02,10,26,27,31,38,39,02 10 26 27 31 38,300000000000,0,66969623500,1
813,110,#00110,14/04/2018,2018-04-14 00:00:00.000000,02,10,14,26,45,54,20,02 10 14 26 45 54,348542745600,0,8393638400,0
814,109,#00109,12/04/2018,2018-04-12 00:00:00.000000,04,29,35,37,42,54,19,04 29 35 37 42 54,341100719850,0,7566746650,0
815,108,#00108,10/04/2018,2018-04-10 00:00:00.000000,01,22,25,31,36,48,41,01 22 25 31 36 48,333842446200,0,6760271800,0
816,107,#00107,07/04/2018,2018-04-07 00:00:00.000000,12,24,33,34,36,53,05,12 24 33 34 36 53,324541622100,0,5726846900,0
817,106,#00106,05/04/2018,2018-04-05 00:00:00.000000,07,09,17,25,31,32,06,07 09 17 25 31 32,317878643550,0,4986515950,0
818,105,#00105,03/04/2018,2018-04-03 00:00:00.000000,20,21,39,42,51,53,01,20 21 39 42 51 53,311346404850,0,4260711650,0
819,104,#00104,31/03/2018,2018-03-31 00:00:00.000000,03,07,31,43,51,53,26,03 07 31 43 51 53,303276464400,0,3364051600,0
820,103,#00103,29/03/2018,2018-03-29 00:00:00.000000,05,27,35,39,46,52,31,05 27 35 39 46 52,300000000000,0,7207922000,1
821,102,#00102,27/03/2018,2018-03-27 00:00:00.000000,09,13,14,15,54,55,22,09 13 14 15 54 55,300000000000,0,25040212000,1
822,101,#00101,24/03/2018,2018-03-24 00:00:00.000000,01,30,38,45,48,50,12,01 30 38 45 48 50,311943369900,0,4327041100,0
823,100,#00100,22/03/2018,2018-03-22 00:00:00.000000,01,08,24,33,34,41,20,01 08 24 33 34 41,304515142950,0,3501682550,0
824,99,#00099,20/03/2018,2018-03-20 00:00:00.000000,11,40,43,46,49,55,37,11 40 43 46 49 55,300000000000,0,74754860000,2
825,98,#00098,17/03/2018,2018-03-17 00:00:00.000000,03,14,28,35,50,52,29,03 14 28 35 50 52,321738459600,0,5415384400,0
826,97,#00097,15/03/2018,2018-03-15 00:00:00.000000,15,20,23,28,39,49,19,15 20 23 28 39 49,314502409200,0,4611378800,0
827,96,#00096,13/03/2018,2018-03-13 00:00:00.000000,01,02,17,46,47,49,44,01 02 17 46 47 49,306583901400,0,3731544600,0
828,95,#00095,10/03/2018,2018-03-10 00:00:00.000000,09,20,27,31,48,49,42,09 20 27 31 48 49,300000000000,0,70013824500,1
829,94,#00094,08/03/2018,2018-03-08 00:00:00.000000,14,17,18,23,41,52,40,14 17 18 23 41 52,350981591250,0,8664621250,0
830,93,#00093,06/03/2018,2018-03-06 00:00:00.000000,02,06,13,22,40,48,12,02 06 13 22 40 48,342197962500,0,7688662500,0
831,92,#00092,03/03/2018,2018-03-03 00:00:00.000000,04,10,32,37,47,52,49,04 10 32 37 47 52,332230461150,0,6581162350,0
832,91,#00091,01/03/2018,2018-03-01 00:00:00.000000,04,05,07,17,20,38,09,04 05 07 17 20 38,323797375200,0,5644152800,0
